Original Description,Synthesized Descritpion,Permission,Semantic Rating,Syntax rating,Length rating
"it’s a lightweight browsers especially useful to users of android phones with lower space and less storage space, but still packed with great features",this app check availble storage device storage space,STORAGE,,,
Share on social media or save for wallpaper,save photo to your phone gallery set as wallpaper,STORAGE,,,
"When you download the village routes in advance, you don’t have to worry about mobile data or roaming costs",you cann download file to storage for offline,STORAGE,,,
"You can save or share your photo to Instagram, its very simple and cute!",save photo to your phone gallery,STORAGE,,,
Save and track fishing locations- Find saved locations with GPS navigation system- Measure road and direct distances,this app will use location and gps data to set destination and navigate routes,STORAGE,,,
Download this theme and Facemoji Keyboard,(some) external storage support,STORAGE,,,
"Summary and each category statsCost charts (fuel vs other costs, categories, total monthly costs)Reporting module - create report for your car, save it to TEXT file and share it!",save files to external storage,STORAGE,,,
The app tracks the content you open and allows you to save your favourite resources for an easy and immediate use!,save files to cache use download files,STORAGE,,,
It also provides features that help users storing and selecting varieties of book,download books,STORAGE,,,
"It's easy to save the information you want for laterWith the app, download and access the paper when you are offline",you can download pdf file paper for offline use,STORAGE,,,
write storage: save pictures to external directory,save photo to your phone gallery,STORAGE,,,
"Just search a fresh font you like, then you can own it by clicking download at the end of the screen",this app will use external storage space,STORAGE,,,
"Once you have completed your animated flower frames, you can save them as live wallpapers and set them as your phone’s background, or save your project as an image",save photo to your phone gallery you can set as wallpaper and set as wallpaper background,STORAGE,,,
read external storage reading files for uploads and reading cached images,this app use read external storage to read storage read files in storage,STORAGE,,,
"Catch up / listen again to all your favourite shows whenever you like Download and listen to shows offline, perfect for listening while you're travelling",download mp3 ringtones for offline use,STORAGE,,,
"With the save button, you can save your pictures in the gallery android",save photo to your phone gallery,STORAGE,,,
save the picture in your phone you can also send it to friends right there,you can take photo with the the camera or take photo from photo gallery,STORAGE,,,
upload any pdf form or document from local storage or cloud drives,read your files and upload,STORAGE,,,
Save your image to SD card,save photo to external storage,STORAGE,,,
HD Neon Wallpapers with Own Photo SupportGet rid of your boring lock screen and download our Latest Lock screenIt has many beautiful HD Cars wallpapers to download for FREE!,you can download image free for wallpaper download,STORAGE,,,
read game data from device storage,(some) external storage support,STORAGE,,,
Save images or take a photo quickly by a single touch of a button,take pictures using device camera or select photo from gallery,STORAGE,,,
"Events can easily be subscribed to, shared and saved for later",save as pdf format,STORAGE,,,
Save chosen articles for reading later,download files for offline offline use,STORAGE,,,
"Browse tricks, download videos, and buy Yoyos and accessories",you can download files to storage,STORAGE,,,
Our app needs access to device microphone.,the app will use device microphone,MICROPHONE,,,
Light  up  the  cigarette  and  start  smoking.  You  need  to  blow  into  the  microphone  to  smoke.,the app will use your microphone,MICROPHONE,,,
Digital  photographic  images  and  audio  clips  from  onboard  cameras  and  microphones  can  be  tagged  to  specific  observations  and  locations.,this app use microphone you can take pictures and record using microphone of your device microphone,MICROPHONE,,,
(Some)  external  microphone  support.,the app will use your microphone,MICROPHONE,,,
This  application  allows  you  to  record  any  audio  using  the  microphone  of  your  phone.,you can use your microphone of you microphone to record audio,MICROPHONE,,,
Allows  the  APP  to  make  Recordings  using  the  microphone.,the app uses your microphone to start to record,MICROPHONE,,,
This app supports voice recording,you can record use microphone of your device microphone,MICROPHONE,,,
This  application  implements  camera  and  microphone  function  to  take  photos  and  videos.,the app uses your microphone and camera you can can take pictures with your camera,MICROPHONE,,,
Speech  to  text  is  so  efficient  and  easy.  Simply  click  the  microphone  and  start  recording,the app uses your microphone microphone can listen your voice,MICROPHONE,,,
"This  app  uses  Administrator  Permissions,  the  features  require  authorization  by  the  user  to  access  the  camera  and  microphone  controls.",the app will use your microphone,MICROPHONE,,,
"Start  practicing  and  measure  the  duration  with  the  Musician’s  diary,  additionally  You  can  record  Your  practice  with  Your  device’s  microphone.",record your practice you can record your practice via microphone,MICROPHONE,,,
Blow  into  the  microphone  to  raise  the  bubble. Set  the  microphone  sensitivity  to  your  blows.,the app uses microphone,MICROPHONE,,,
"Scream  into  your  phone's  microphone  to  make  the  rocket  ""jump"".",app will access your microphone,MICROPHONE,,,
Record  sound  clip  -  Lockwatch  will  record  a  20  second  audio  clip  using  the  phone's  microphone.,this app cann record audio sound using microphone,MICROPHONE,,,
"It  allows  you  to  record  in  different  formats  and  extensions  (.3gp,  .mp4,  .m4a,  .amr)  via  bluetooth  and  via  built-in  microphone.",app uses microphone to record,MICROPHONE,,,
"Echo  button  grant  access  to  microphone  for  the  echo  function  (since  you  press  echo  camera  button  may  not  work  in  some  models  until  you  restart  the  app,  because  permissions  to  access  microphone  simultaneously  are  disabled  in  some  models  and  android  versions).",press to make recording the app will use microphone,MICROPHONE,,,
"CUSTOM  in  this  option  you  can  create  your  own  card  sets  using  text  notes,  pictures,  videos  and  you  can  use  your  microphone  to  use  your  voice  like  a  card.",this app need access to device microphone record voice using microphone,MICROPHONE,,,
This  application  allow  you  to  use  the  microphone  of  your  phone  as  a  sound  level  meter.,sound measure microphone use,MICROPHONE,,,
(some) external microphone support,the app can use microphone of your microphone,MICROPHONE,,,
(some) external microphone support,the app can use microphone of your microphone,MICROPHONE,,,
(some) external microphone support,record microphone support,MICROPHONE,,,
(some) external microphone support,this app will use your microphone,MICROPHONE,,,
(some) external microphone support,record microphone support,MICROPHONE,,,
(some) external microphone support,app can use microphone permission,MICROPHONE,,,
(some) external microphone support,the app can use microphone of your microphone,MICROPHONE,,,
Counts  with  microphone  if  the  preset  noise  level  exceeds  the  preset  threshold,use microphone detect noise set alarm when threshold reached.,MICROPHONE,,,
The  app  has  a  sound  meter  mode  that  analyzes  sound  using  the  microphone.,this app uses microphone,MICROPHONE,,,
"If  you  use  the  voice  recognition  feature  of  the  app,  the  ""allow  to  record  audio""  permission  is  required  so  you  can  speak  the  commands  into  the  microphone.",you can record your voice using microphone of your device microphone,MICROPHONE,,,
Smartphones  microphone  to  measure  the  sound  pressure  level.,the app uses your microphone to start to record,MICROPHONE,,,
"Click  on  that  microphone  and  microphone  turns  green When  it  is  green  you  can  start  speaking, In  return  keyboard  will  type  your  voice",press green button microphone will record using microphone from your device,MICROPHONE,,,
"Not  only  the  local  bird  variations  but  the  microphone  you  use  play  a  large  part  in  identification.  That  said,  by  downloading,  and  defining  the  birds  the  app  will  be  able  to  recognize  many  of  the  birds  that  you  record.",you can use your microphone,MICROPHONE,,,
Tap  the  microphone  button  and  Santa  Claus  repeat  what  you  say.,record to use the microphone,MICROPHONE,,,
vSilencer  uses  your  device  microphone  to  sense  the  environmental  noise  and  alerts  you  when  desired  threshold  level  is  reached,use microphone detect noise set alarm when threshold reached.,MICROPHONE,,,
"voice  and  call  recorder  for  Android  devices.  Use  it  for  record  voice  memos,  talks,  music  and  songs  in  high  quality.",record microphone support use microphone of your device,MICROPHONE,,,
Record  using  your  phone's  microphoneuse,this app will use microphone,MICROPHONE,,,
"all  audio  input  comes  from  your  Android  device's  microphone.  So,  avoid  using  headphones  when  recording.",this app will use microphone,MICROPHONE,,,
"You  can  set  the  sensitivity  of  the  microphone  and  the  audio  level  in  the  menu.  If  the  audio  level  is  0,  the  vibrator  is  used.",access device microphone you can record to use microphone,MICROPHONE,,,
"This  kitchen  timer,  use  the  recorded  voice  as  an  alarm. Will  be  recorded  and  then  hold  the  microphone  button.",record microphone support,MICROPHONE,,,
"Use  the  on-screen  fingerboard,  or  play  your  real  instrument  through  the  device's  microphone.",record your practice with microphone of your device,MICROPHONE,,,
In  simulation  you  can  use  finger  to  tap  screen  as  a  manual  process  and  microphone  as  a  breath  simulation.  On  left  part  of  screen  you  can  show  rate  of  heart  massage.  After  30  finger  clicks  you  have  to  make  breath  twice  (blow  into  microphone).,this app will use microphone,MICROPHONE,,,
Output  the  microphone  input  of  the  smartphone  from  the  audio  plug.  Also  at  the  same  time  recording.,you can record to use microphone,MICROPHONE,,,
Mic  Studio  app  can  make  a  records  by  a  mobile  microphone,record using microphone,MICROPHONE,,,
"To  open  all  the  doors  and  to  comlete  the  game  you  also  need  a  complete  utilization  of  your  device  features  and  sensors  (accelerometer,  microphone  and  more).",this app will use microphone,MICROPHONE,,,
"The  application  functions  by  picking  up  sounds  using  the  smart  devices  microphone  then  notifying  through  on  screen  notifications,  vibrations,  and  flashing  lights  on  your  smart  device.",you can use microphone to record your voice,MICROPHONE,,,
Sound  Meter  [dB  Save]  it  is  displayed  in  dB  using  the  built-in  microphone  of  the  mobile  phone  apps  and  shows  the  amount  of  ambient  noise  in  decibels. And  this  app  will  help  you  measure  the  noise  of  everyday  life  with  easy-to-use.,the app can use the microphone and you can record voice,MICROPHONE,,,
"You  can  use  it  as  a  regular  dictaphone  for  record  voice  notes  and  memos,  speeches,  business  meetings,  interviews,  lectures,  concerts  or  anything  else!",this app will use microphone,MICROPHONE,,,
"Setup  Visual  Hearing  Aid,  add  on  a  microphone,  and  stop  wondering  if  you  got  the  order  right.",access microphone support,MICROPHONE,,,
Access microphone,this app will use microphone,MICROPHONE,,,
"Voice  Commands  provides  the  most  comfortable  way  to  start  navigation.  You  don't  have  to  type  destination  on  keyboard,  just  say  the  address. Favorite  addresses  can  be  saved  as  shortcut  commands.  Then  just  click  microphone  button  and  say  for  example  ""home"".",the app can use the microphone and use the microphone record your voice,MICROPHONE,,,
Use  microphone  rights  to  measure  the  strength  of  the  sound.,the app use microphone of your device,MICROPHONE,,,
"Speak  to  text  or  audio  to  text  keyboard  has  a  simple  mechanism  to  work,  just  tap  on  microphone  and  start  speaking  what  you  need  to  write  and  it  will  change  to  text  by  voice,  after  you  are  done  it  will  convert  it  into  text",you can record your voice with microphone of your device,MICROPHONE,,,
This  app  will  use  the  phone  microphone  to  measure  environmental  noise  decibels  (dB)  and  show  a  value  for  reference.,access your microphone to measure sound level alert reached reference,MICROPHONE,,,
Tap  and  hold  the  microphone  till  you  speak  and  release  microphone  when  you  are  done  speaking.,you can use microphone of your microphone to record your voice,MICROPHONE,,,
You can record your voice in high quality.,microphone record support,MICROPHONE,,,
Record  My  Call  has  a  basic  purpose  to  record  all  your  call,the app use microphone of your device,MICROPHONE,,,
Select mp3/music from your mobile or Recordings,app use microphone of your microphone,MICROPHONE,,,
Microphone  -  Record  audio  from  your  microphone.,this app will use your microphone,MICROPHONE,,,
Record  audio  from  your  microphone.,this app uses microphone permission to record audio data,MICROPHONE,,,
Audio  test:  microphone  and  call  speaker  (earpiece  speaker),record microphone support,MICROPHONE,,,
Microphone  live  streaming  from  your  Android  device  to  any  streaming  music  player. Capture  sound  from  your  microphone  and  stream  it  live,use your microphone you can stream record your voice,MICROPHONE,,,
"Option  to  take  photo  remotely  by  making  a  noise  (e.g.,  voice,  whistle),  or  by  voice  command  ""cheese"".",you can record your voice using microphone,MICROPHONE,,,
The  app  needs  record  audio  permission  to  use  the  microphone  for  speech recognition.,this app will use your microphone,MICROPHONE,,,
Voice  control  calculator  will  automatically  calculate  what  you  say. It's  very  easy  to  use  and  very  quick  in  calculating  your  voice.,app access microphone record your voice,MICROPHONE,,,
"It  is  a  simple  voice  recorder. To  use  this  application,  you  need  permission  to  use  storage  and  microphone  audio",this app access device microphone you can to record your voice,MICROPHONE,,,
"KangaROOS  can  control  LED  lights  through  the  mobile  phone  APP  to  achieve  patterns,  text,  graffiti,  music  rhythm,  microphone  rhythm  function.",app need microphone permission,MICROPHONE,,,
"Using  voice  to  text  Amharic  keyboard,  you  can  send  voice  text  to  all  the  messaging  application  on  your  phone.",app need microphone permission to record your voice,MICROPHONE,,,
Clicking  on  the  microphone  icon  it  will  be  possible  to  record  the  pronunciation  of  the  word  using  your  own  voice.,this app uses microphone permission to record your voice,MICROPHONE,,,
It  also  detects  the  fundamental  frequency  of  the  audio  (detected  by  microphone).,this app uses microphone permission to detect sound frequence,MICROPHONE,,,
Our app uses microphone resource,record microphone support,MICROPHONE,,,
"The  application  allows  you  to  measure  the  actual  sound  pressure  level,  expressed  in  decibels,  using  the  phone's  microphone.",this app uses microphone on your device,MICROPHONE,,,
"In  addition,  since  dB  Meter  uses  the  microphone  integrated  within  your  device,  which  was  designed  to  record  human  voices,  it  may  not  be  able  to  precisely  measure  very  loud  noises  (>  90  dB).",this app uses microphone permission to record your voice,MICROPHONE,,,
"Record  Video  Calls,  SMS  chat,  Phone  Calls  with  just  one  click. Audio  +  Video  Recording  and  HD  Quality  Available.",record audio data using microphone on your device,MICROPHONE,,,
"You  can  record  the  practice  on  ""Metrothm""  with  the  smart-phone's  microphone.  So  you  can  check  the  recorded  practice. ",record practice with device microphone,MICROPHONE,,,
Children  can  record  your  voice  and  Santa  Claus  repeated  that  special  message. Click  the  microphone  and  your  voice  is  recorded.  A  papa  noel  then  repeats  what  you've  recorded.,the app uses microphone you can to use record your voice,MICROPHONE,,,
"Video  settings:  resolution,  frame  rate,  4K  UHD,  external  microphone  support,  video  audio  recording ",download and use your microphone,MICROPHONE,,,
Play  by  just  touching  the  screen  or  enable  microphone  control  for  the  full  experience.,micophone support,MICROPHONE,,,
"Record  voice  notes,  rehearsals,  classes,  memos ",this app uses your microphone to record your voice,MICROPHONE,,,
Hearing  individuals  speak  into  the  microphone.  Their  speech  is  transcribed  to  text  and  displayed  in  the  note  pad.,app use microphone of your microphone to record audio,MICROPHONE,,,
you  can  also  record  audio  from  the  microphone  and  it  is  automatically  mixed  into  the  recording.,this app uses microphone permission to record audio data,MICROPHONE,,,
Click  on  microphone  and  microphone  turns  green. In  return  keyboard  will  type  your  voice,press button to start record microphone,MICROPHONE,,,
"listen  to  the  phone  surrounding  audio  live  through  your  phone's  microphone,  or  take  a  remote  record  of  microphone ",this app will use device microphone to record your voice,MICROPHONE,,,
The  lights  while  recording  will  tell  you  how  much  noise  your  microphone  is  capturing.,you can measure sound level with microphone from your device microphone,MICROPHONE,,,
For  your  audio  ensure  you  are  using  a  decent  microphone  and  in  area  where  you  have  no  background  noise.,external microphone support,MICROPHONE,,,
"Auto  Recorder,  starts  and  stops  the  record  function  when  sound  of  a  sufficient  level  is  picked  up  by  the  microphone.",this app will use microphone permission to record your voice,MICROPHONE,,,
"It  covert  your  voice  at  high  volume  like  a  loud  speaker  mic.  You  can  use  it  for  voice  chatting,  recording,  and  recognition.",record microphone support,MICROPHONE,,,
Tap  the  MICROPHONE  and  your  voice  is  RECORDED.,the app uses microphone permission you can use to record your voice,MICROPHONE,,,
Access to your device microphone,this app uses microphone of your device,MICROPHONE,,,
"The  App  will  use  your  microphone  signal  for  all  demonstrations.  Please  grant  the  App  access  to  the  microphone  when  prompted,  and  enjoy! ",the app you can use your microphone,MICROPHONE,,,
The  microphone  permission  is  used  so  that  you  can  request  schedule  information  by  speaking  a  request.,you can use microphone to record your voice,MICROPHONE,,,
"Audio  Recorder  is  mostly  known  as  professional,  easy  voice  and  call  recorder  for  Android  devices.  Use  it  for  record  voice  memos,  talks,  music  and  songs  in  high  quality.",the app access microphone of your device microphone to you can use to record your voice,MICROPHONE,,,
Record  high  quality  audio  from  the  microphone  simultaneously  with  the  phone  screen.,you can use microphone use to record your voice,MICROPHONE,,,
this  app  takes  control  of  your  microphone.,record microphone support,MICROPHONE,,,
"Record  unlimited,  high  quality  audio  with  Voice  Memos  using  the  built-in  microphone,  your  headset,  or  an  external  mic.",this app uses microphone permission to record your voice,MICROPHONE,,,
"RecordIt  is  a  sound/voice/microphone  recorder  that  lets  you  record  in  both  3gpp  and  wav  format,  so  you  can  choose  your  preferred  quality.",record microphone support,MICROPHONE,,,
This clock weather app displays weather temperature based on your current location,this app shows weather nearby your location,LOCATION,,,
This clock weather app displays weather temperature based on your current location,access your location to get nearby weather forecast,LOCATION,,,
This clock weather app displays weather temperature based on your current location,this app shows weather nearby your location,LOCATION,,,
This clock weather app displays weather temperature based on your current location,you can use can get weather forecase based on your location data,LOCATION,,,
This clock weather app displays weather temperature based on your current location,this app reads your location you can search nearby service,LOCATION,,,
This clock weather app displays weather temperature based on your current location,access your location and gps data,LOCATION,,,
This clock weather app displays weather temperature based on your current location,get current location of your device,LOCATION,,,
Retrieve the location of your phone via email or MultiMapPro,access location data from your device,LOCATION,,,
GPS positioning,access location and gps data,LOCATION,,,
"Write your note/diary anytime, anywhere and able to organize them by location ",this app reads your location data to location tagging,LOCATION,,,
Access weather information from the closest NOAA buoy to your current location,get weather nearby based on location data,LOCATION,,,
Use GPS to monitor your actual speed and give you sound/voice/flashlight alarms when you exceed a speed that you asked it to watch,get location data get speed access your gps data,LOCATION,,,
The compass built into the app shows the position and distance to the loved person,this app uses location permission to set navigation,LOCATION,,,
You can discover new camping locations around you or anywhere on the map,the app uses location data to get current location on map,LOCATION,,,
"Navier HUD calculates the real-time information via the phone sensor, such as GPS and gyroscope ",access location and gps data,LOCATION,,,
Record travel path by GPS,access gps to record your location,LOCATION,,,
enter the coordinate to find the current position of your stolen phone on map,the app uses gps map display your location,LOCATION,,,
"Locate your family, friends on the map ",access location information,LOCATION,,,
"Search and get transit route to the places, from your location or between any two locations ",the app access location information you can navigate locations on map,LOCATION,,,
"This application helps you to create a friend circle where you can share your location, track your buddies location ",this app use read contact permission to read contact,LOCATION,,,
"A date and time stamp on photos, location coordinates and implements a custom text ",tag your photo with location information,LOCATION,,,
Camera can remember your photos and videos location if you wish,read your location,LOCATION,,,
Location access for location based search,app use location information,LOCATION,,,
"Application uses Android device GPS(BEIDOU, GLONASS) to track your activity and track your progress live on map ",this app uses gps data to track location,LOCATION,,,
location based push notifications for newly detected fires within a range of your last known location or location preference,this app read your location information,LOCATION,,,
"Accurate positioning: automatically locate your position, and able to track weather in multiple locations ",track your location with location data,LOCATION,,,
Sharing Current GPS Location,this app read your location and gps data,LOCATION,,,
Status bar on the home screen displaying the current temperature for your current location,access location information,LOCATION,,,
Automatic map centering in the user's location,read gps data,LOCATION,,,
Visualization of the user's position on the map,this app uses location and gps,LOCATION,,,
Shows your location (red dot) on a world map,get current location information of your device,LOCATION,,,
Featuring city maps- Display orders with GPS coordinates,read gps data,LOCATION,,,
"Location, so Offi can show nearby stations and navigate you from your current location ",this app uses location data to get nearby information,LOCATION,,,
Record the shooting location information,access location and gps information,LOCATION,,,
Location - used to update LocalTrader location - only when user manually updates it,access location informationn,LOCATION,,,
The app uses your current GPS location,access location and gps data,LOCATION,,,
Individual car location and walking navigation to it,access your location information you can use navigation,LOCATION,,,
Individual car location and walking navigation to it,access location and location gps data,LOCATION,,,
Automatic location detection,this app read your location data,LOCATION,,,
Save location information,this app read your location data,LOCATION,,,
Find and track your location and get detailed GPS data,this app read gps data and you can track location,LOCATION,,,
Allows you to book a taxi using a mobile phone using the exact address as well as the coordinates of GPS,you can use your location data of your device,LOCATION,,,
By selecting the location the app will display the prayer timing of your city,this app read your location data,LOCATION,,,
An application that can track your travels of your Android by storing your GPS locations,app read gps data you can track your location,LOCATION,,,
