Original Description,Synthesized Descritpion,Permission,Semantic Rating,Syntax rating,Length rating
create events today,write calendar event,CALENDAR,,,
"view and rsvp to public events, and add events to your phone calendars",get event add calendar to calendar,CALENDAR,,,
download this vital hr management application today constant updates will be provided to improve stability and improve the overall experience,access phone calendar,CALENDAR,,,
schedule service with your participating dealer,write calendar to schedule appointment,CALENDAR,,,
football game will be added to your calendar and update,access calendar to write calendar event,CALENDAR,,,
This app provides class schedules,app uses calendar you can add to calendar,CALENDAR,,,
download the app to stay updated on the latest news & announcements,access location and gps,CALENDAR,,,
"you can view all schedules in calendar, or create a schedule.",app uses read calendar to read calendar and write calendar,CALENDAR,,,
"access events, calendars, contacts, maps and more!",app uses read calendar to read calendar,CALENDAR,,,
Download the app today to plan and schedule your classes,write classes schedule to calendar,CALENDAR,,,
"read,  add  or  modify  calendar  events, also backup and restore calendar",app access calendar to read calendar and write calendar set backup files,CALENDAR,,,
add your ticket bookings to your device's calendar to get notifications and integrate with your existing schedule,write calendar data set notification alarm,CALENDAR,,,
"schedule management, display schedule on calendar",app uses read calendar to read calendar,CALENDAR,,,
manage room bookings via calendar,app uses read calendar to read calendar,CALENDAR,,,
Set reminders for live broadcasts so you don’t miss a program you love,add to calendar set up reminder,CALENDAR,,,
the event calendar is also easily accessible from the app,access calendar read event notification,CALENDAR,,,
import your appointments to calendar and mark them as mute events,setup appointments to write to calendar,CALENDAR,,,
"set training calendars, reminders",access calendar,CALENDAR,,,
notification academic calendar events and institutional notices,access calendar read calendar notifications,CALENDAR,,,
check out what’s on to plan your calendar and buy tickets to events,write event to calendar of your device,CALENDAR,,,
find incidents near your calendar events,get location and gps data read calendar,CALENDAR,,,
access to calendar to link up group member calendar,this app uses calendar permission to read calendar,CALENDAR,,,
calendar navigation giving easy access to previous scores and upcoming fixtures,the app read your calendar information,CALENDAR,,,
show calendar events in agenda and select which calendars to show,the app can read calendar,CALENDAR,,,
access event and calendar information and add them directly to your device or share them with a friend,this app write to your calendar in your device,CALENDAR,,,
show the school calendar for better time and activity management,access to your calendar,CALENDAR,,,
display calendar and schedule of matches,this app uses calendar permission to read calendar,CALENDAR,,,
you can add priority events to the personal calendar on your device,add events to device calendar,CALENDAR,,,
the calendar module displays all events occurring in the current week,this app uses read calendar permission,CALENDAR,,,
calendar  sync,access calendar information,CALENDAR,,,
make use and manage your calendar,the app you can use your calendar,CALENDAR,,,
"you  can  set  the  moving  target,  to  encourage  yourself  to  complete  the  amount  of  exercise  every  day ",set up calendar on device,CALENDAR,,,
one  tap  to  create  and  sync  a  customer  meeting  with  your  calendar,the app uses calendar permission to write to calendar,CALENDAR,,,
"view, edit and update your schedules in calendar ",this app uses calendar permission read calendar and write calendar,CALENDAR,,,
the  app  will  be  used  to  announce  important  schedule  updates  and  keep  you  informed  throughout  the  four-day  event,access your device calendar read calendar information,CALENDAR,,,
create and check calendar events,you can read calendar with your device calendar add calendar events to device calendar,CALENDAR,,,
access and sync your calendar anytime anywhere,this app access calendar of your device calendar,CALENDAR,,,
read  calendar  events you  can  get  the  list  of  calendar  events  with  all  details  and  descriptions,the app uses read calendar permission to read calendar,CALENDAR,,,
"can  create  calendar  entries  for  birthdays,  anniversaries  and  other  events ",this app uses calendar permission you can add calendar events,CALENDAR,,,
making reminder,access calendar permission,CALENDAR,,,
add  special  notes  to  cards  and  personal  reminders  to  your  calendar,you can add events to your device calendar,CALENDAR,,,
"This mode is used as loudspeaker, megaphone or microphone. Touch the Start button in the first mode. Speaking into the lower part microphone ",the app uses microphone to record your voice,MICROPHONE,,,
"this top app supports recorded speech with high quality audio, smart sermon, voice notes, prayers and personal recordings ",you can use to record with device microphone,MICROPHONE,,,
This application allows you to control latest Home Audio and Home Speaker devices,this app uses microphone permission to record your voice,MICROPHONE,,,
Audio Recitation - The reciter recites complete Islamic Dua and a highlighter scrolls through the dua simultaneously to show the word being read,this app uses microphone of your device microphone,MICROPHONE,,,
"One very unique effect that sets this app apart from any other is it's ability to use audio input such as the microphone or playing music, to manipulate effects ",you can record to use device microphone,MICROPHONE,,,
Microphone: Used to provide recording function,this app uses microphone permission to record audio data,MICROPHONE,,,
This app uses the microphone to detect sound and convert it into an SPL value FOR INDICATION ONLY,app uses microphone of your device and measure sound level,MICROPHONE,,,
"detect the pitch of notes that picked up by a microphone, and it displays the difference from the fine pitch",app uses your microphone,MICROPHONE,,,
record sound from microphone,start recording use microphone,MICROPHONE,,,
detect human voices and start recording conversation.,need to access microphone support recording,MICROPHONE,,,
laugh out loud at tom’s funny voice,app uses microphone of your device,MICROPHONE,,,
simply record yourself saying a phrase and then hear your voice next to the teacher’s,you can record your voice with microphone on your phone,MICROPHONE,,,
audio recording,app uses microphone record your voice,MICROPHONE,,,
access microphone to have high quality phone calls,the app uses microphone of your device,MICROPHONE,,,
practise until you get it right – you can even slow the audio down if it’s too fast,record practice you can record practice using microphone,MICROPHONE,,,
"Multimedia Notes - Enrich your tasks with pictures, videos and audio recordings",the app uses microphone permission to record your voice,MICROPHONE,,,
"Then use them in just a single click!MULTIMEDIA NOTESEnrich your to do list tasks by attaching pictures, videos and audio recordings",this app uses microphone of your device you can record to your voice,MICROPHONE,,,
make free voice and video calls to your friends and family,the app use microphone of your device microphone,MICROPHONE,,,
support voice message,start record message via microphone support,MICROPHONE,,,
talk to husky dog and he will repeat everything you say with a funny voice,you can use your device microphone,MICROPHONE,,,
"you can apply voice recognition to see what you have talked, and also voice recording function to let you play back what you have spoken",the app uses microphone to record,MICROPHONE,,,
use microphone to measure noise,sound level detection by microphone,MICROPHONE,,,
add a voice note to quickly record meeting notes,the app uses your microphone,MICROPHONE,,,
talk to santa claus and he will repeat everything you say with a funny voice,this app use microphone to record,MICROPHONE,,,
you can use the microphone to record a storybook by voice,you can use record microphone,MICROPHONE,,,
required to record audio through microphone,record voice by microphone,MICROPHONE,,,
recording your voice,start record from your microphonne,MICROPHONE,,,
listening to audio playbacks,app uses your microphone from device,MICROPHONE,,,
our app listen to speech and type notes.,start listen to convert to text using microphone,MICROPHONE,,,
record your music and share it,use your microphone to record share with friend,MICROPHONE,,,
access device microphone to have audio and video chat.,use device microphone start chat via audio,MICROPHONE,,,
send voice messages,recording use microphone send message,MICROPHONE,,,
unlimited time to record screen and audio,microphone support required,MICROPHONE,,,
"video chat, audio chat, instant messaging, this app makes instant messaging fun",start call using your microphone,MICROPHONE,,,
listen or talk back with built in microphone and speaker,app use your microphone of device,MICROPHONE,,,
we collect your audio information,you can use your microphone,MICROPHONE,,,
speak and he repeats what you say in his own funny voice,the app will use your microphone,MICROPHONE,,,
record your own voice and apply effects,you can use your microphone start record,MICROPHONE,,,
"touch, you can listen to the car audio",access microphone of your device microphone,MICROPHONE,,,
place a business-quality video or voice-only call into a business from your android device,the app will use your microphone,MICROPHONE,,,
"You'll know the progress percentage of them in each moment, save reference images of the character, know the total cost and time you've invested in making each of its elements and the time lapse of your project",save image to your gallery,STORAGE,,,
"Simply share files and folders in DirectBox by a link with othersBackup your smartphone photos, documents, videos to the cloud and use them anytime when you want ",you can download files of your device,STORAGE,,,
they can able to edit image or open image from storage easily,take pictures and open image from photo gallery,STORAGE,,,
download and pay your bill,download image to your device,STORAGE,,,
"This is the app for the IWCS International Cable Symposium It will allow you to download the program, browse the content and schedule and create your own itinerary for the event",external storage support,STORAGE,,,
write external storage: it uses to show ads,download files to your storage,STORAGE,,,
The devotions can be read off-line and hopefully the bible verses will be fetched and stored locally too for reading - though only the current day,you can download download books,STORAGE,,,
this app requires read and write external storage permission.,download ringtones for your device,STORAGE,,,
Watch later functionality to save and watch the videos laters,download videos to your phone and for later use,STORAGE,,,
"downloaded data updates, your personal notes or stars, or your login credentials require the app to have permissions to external storage",download files to your phone,STORAGE,,,
"Your favourite tunesLike the song currently playing? Add it to your favourites, listen to it later or download it ",download mp3 for your device offline use,STORAGE,,,
save photo to device storage,save your photo to gallery,STORAGE,,,
The app also allows you to save marked-up images,save your photo to gallery,STORAGE,,,
storage access: to save your booking voucher,download image,STORAGE,,,
Store message to local database and send it later,save as file to storage,STORAGE,,,
you can share any image with your friends on social networks or save it to your photo gallerysaving images in the gallery device,save your photo to gallery,STORAGE,,,
Instantly save the collage and share it on any social networking platform,download files,STORAGE,,,
"All sounds can be saved as Ringtones, Notifications and Alarms by long pressing on a bird and selecting the relevant optionPermissions are required for saving birds sounds and displaying advertisements",download ringtone mp3 for your device,STORAGE,,,
"In the offline mode user can look through all sermons and albums, and listen to all downloaded tracks",download mp3 for offline uses,STORAGE,,,
read and write storage permission for save the data as file,save file to your storage,STORAGE,,,
"create a new program file, open, save,automatically save file",save file to your storage,STORAGE,,,
View and download your account and personal/home finance statement as well as Credit Card statement (Outstanding Authorizations- Unbilled- Billed),save image to your gallery,STORAGE,,,
storage - for saving app settings to the phone,save file to your storage,STORAGE,,,
Work offline by downloading content,you can download files,STORAGE,,,
"Save articles and viral stories for reading later, and share on Facebook and Twitter",save files to your storage,STORAGE,,,
"Save articles and viral stories for reading later, and share on Facebook and Twitter ",download download files for your storage,STORAGE,,,
Editing photos in your phone gallery very easySelect a photo from the gallery to editSave photo into phone's gallery,take pictures and save image to gallery,STORAGE,,,
mobile info is to display information about your device such as: * storage info,external storage support,STORAGE,,,
Save your creation to App Gallery or your SD card,save image to your gallery,STORAGE,,,
Save wallpaper to photo gallery,save image to your gallery,STORAGE,,,
"These events can be grouped together as a Brew Session and can be saved to device memory in a Recipe Profile that can then be loaded when needed for future useCreate, save, load, and delete multiple Recipe Profiles",download files to your storage,STORAGE,,,
"Create custom categories, log item purchase date and cost, store photos, and make notes",external storage support,STORAGE,,,
download recordings to a usb storage,you can download recordings,STORAGE,,,
storage: used to upload / download files and images,download contacts and images to your storage,STORAGE,,,
Select a romantic photo from the gallery of your phone and use this image editor to decorate it!Save your new picture and share it instantly on social networks like Facebook or Twitter!,take pictures with effects filters from your camera,STORAGE,,,
you can save all pictures to sd card or cloud storage accounts,save image to your storage,STORAGE,,,
"After you’ve downloaded and enjoyed the content, you can share it with your friends via Twitter, Facebook, or email",download ringtones mp3 enjoy offline use,STORAGE,,,
Snap a photo of your look and save it to your device,take pictures from your camera save image to your storage,STORAGE,,,
"Galaxy Camera app can take impressive photos and save the moment at any time, any place",this app use camera to take photo and save from gallery,STORAGE,,,
Import photos from gallery or take from camera,take pictures from your camera or take from gallery,STORAGE,,,
Select a photo from the gallery to editSave photo into phone's gallery,you can take photo from camera or take from gallery,STORAGE,,,
access to file storage: this is necessary so downloaded files can be cached on the external memory of the device,download files to your storage,STORAGE,,,
the majority of funds is kept in secure offline storage by freewallet,external storage support,STORAGE,,,
you can download the songs and read them offline later-and as a subscriber this is all free,download free ringtone song,STORAGE,,,
Best good morning sticker download Then send it to their friends or loved ones can be sent via social including Facebook Line Instagram Twitter easily fast !!,save image to storage,STORAGE,,,
permission to save and read necessary game data externally,download files to your phone,STORAGE,,,
Visitors have the option to stream or download content,download files,STORAGE,,,
[Main function]-  Live Display/capturing- Live image display from DS-L4- Capturing/Saving by your owned device-  Browse- Possible to browse the image saved at DS-L4- Possible to browse the image captured by your owned device-  Administration- Possible to download the images saved at DS-L4- Administrate the valuable images by saving at your favorite,you can download and take photos from camera or take from gallery,STORAGE,,,
You can save Instagram photo&video with Just one touch You can instantly check and delete stored photos & videos- It can be saved to the folder for each user- It can be stored in a folder without user identification,save the image to a folder in your device,STORAGE,,,
Automatically saves pages to read offline,save pdf download to storage,STORAGE,,,
"Skim through the news and decide what you want to read, save or share!",you can download pdf to your storage,STORAGE,,,
You can save or share to your friends after finish with this photo filter/photo effect,you can take photo from your gallery to share,STORAGE,,,
"We provide a simple & elegant way to save your favourite text messages/Images and share them with rest of the world through SMS, Email, Facebook, Twitter, Whatsapp, Hike and more",save photos to your phone gallery,STORAGE,,,
"You can save photo edits, share to social media, set as wallpaper or make a Photo profile or display picture on social networking",you can take photo with camera and to take with phone gallery,STORAGE,,,
"You can save photo edits, share to social media, set as wallpaper or make a Photo profile or display picture on social networking ",you can take photo with camera and to take with phone gallery,STORAGE,,,
"save files to external storage of your device, such as photos, videos, and audio",you can save save files to your phone storage,STORAGE,,,
import photos and videos from your phone and SD Card.,save photo to your phone gallery,STORAGE,,,
Add image: User also select another picture From gallery to write something about itsave:simply you can save your picture in Arabic Post Folder In SD card,take pictures with device camera and take from gallery,STORAGE,,,
"Save your creative work, share with your friends and family and impress them with your new awesome look",save photo to image gallery or storage,STORAGE,,,
The database will be downloaded when the application is first run,download files for offline,STORAGE,,,
You can download and share Malayalam trolls to all platforms on the go,download ringtones for your device,STORAGE,,,
save record files to customized storage folder,save recordings to your phone storage,STORAGE,,,
"You can edit photos, choose layouts, create unique designs and send cards conveniently from your phone",open camera and take photos with camera or select photo from the gallery,STORAGE,,,
download backgrounds to your sd card or phone storage,download image to your phone storage,STORAGE,,,
store the game on an external storage drive,(some) external storage support,STORAGE,,,
A standard warning is shown by Android for all keyboards that you downloadOnly the words you typed are saved in local dictionaries for better predictions,download contacts and image,STORAGE,,,
scan and save the file as picture or pdf document to device storage,save as pdf to your storage,STORAGE,,,
Listen to the FREE built-in playlist and add more songs from your personal library,download mp3,STORAGE,,,
"modify delete usb storage contents modify delete sd card contents: saving scans on the sd card, importing images from the sd card",save image to phone storage,STORAGE,,,
Notes are saved as plain txt files,save files,STORAGE,,,
Download videos for instant offline viewing,download files for offline use,STORAGE,,,
Cut the best part of your audio song or MP4 video and save it as your Ringtone/Alarm/Music File/Notification ToneSave as Ringtone/Music/Alarm/Notification,download mp3 set as ringtone set as notification alert,STORAGE,,,
Allows you to save good writing,save files to your phone storage,STORAGE,,,
"You can choose a photo from the gallery or you can take a photo with the camera, and then apply the wood photo frame that you most like and you can save the photo to you Internal Memory/SD Card",you can take photo from gallery or take from camera and save image to your device storage,STORAGE,,,
Download Editions for Offline Reading – Great for when you’re on the go,download pdf to read offline,STORAGE,,,
"JetContacts saves each of your contacts in a customizable form and if they serve other fields, the form can be modified from the back office in real time",download contacts as pdf file,STORAGE,,,
"Also with the app offers a small download, making applications more quicklySave your favorite images to your collection",save image to your phone gallery,STORAGE,,,
download the song notes and use offline.,download mp3 for offline use,STORAGE,,,
for each calculation you can save the result in pdf in your external storage of your mobile device,save file as pdf to your storage device,STORAGE,,,
All recordings will be saved automatically,you can use your microphone to record,STORAGE,,,
"Generate GST Ready Invoice using this free invoicing app, share your invoice through emails or download it in PDF form",download files as pdf invoice,STORAGE,,,
"MyClassboard provides communication app for Chennai parents using which they can download school announcements, Class assignments, Events",download files to your phone storage for offline,STORAGE,,,
This app requires an initial Internet connection to download photos (either Wifi or cellular),save image to device gallery,STORAGE,,,
This app requires an initial Internet connection to download photos (either Wifi or cellular),you can download photo to your device,STORAGE,,,
"It provides multiple functionalities, including real-time live view, video recording, remote search and playback, file backup, etc",this app use microphone of your device you can record microphone,STORAGE,,,
SAVE DATA TO SD Save all your notes in your SD card,external storage access,STORAGE,,,
save the recordings to internal storage or sd card,save recordings to app cache,STORAGE,,,
"allows to view auction notice, download document and submit your bid in Reverse auctions listed on ProcureTiger",download file as pdf format and use offline,STORAGE,,,
HD Video Downloader allows you to download a streaming video from various websites for free,download video online,STORAGE,,,
eat your Christmas Cake or save it to the Photo GallerySave Christmas Cake to Photo GalleryChristmas Cake Maker Instructions: Select cake flavorFinish by eating cake and save to photo gallery,save image to your gallery,STORAGE,,,
reduce your photos size and save your storage space,open photo from gallery and resize photo resize files,STORAGE,,,
"clear junk files such as system and app buffers, apk files & temporary useless files and free up storage space on your device",delete files to clean your device storage,STORAGE,,,
Save your new picture and share it instantly on social networks!,save image to gallery share photo with friends,STORAGE,,,
"photo storage management, easy photo editing functions, save, delete, share, set as wallpaper",take pictures from photo gallery you can modify photo wallpaper,STORAGE,,,
Save and share your results with friends and teachers,save files as pdf format,STORAGE,,,
Circle Collage MakerCircle Collage is the best Photo Collages when you have a Circle Shape,save your photo to gallery or storage,STORAGE,,,
Save high resolution photo montages to your phone gallery!,save photo to your phone gallery,STORAGE,,,
save photos or videos to device storage,save photo to your phone gallery,STORAGE,,,
Download Backgrounds 4K (HD Wallpapers)to stylize your device's home screen and make it uniqueThe images can easily be saved to your phone /tabletChoose the image you want and Save this image (you can a lot of images),you can download download photo to storage or sd card,STORAGE,,,
storage - save charts to phone storage,download file to device storage availble space,STORAGE,,,
Listen & download sermon audio and podcasts,download mp3 ringtone for your device,STORAGE,,,
You can save your videos in new format in simple stepsYou can also compress video in simple and easy steps,the app you use you can save videos to your storage,STORAGE,,,
Save to gallery,save photo to your phone gallery,STORAGE,,,
You can also download mp3 on your phone to listen without internet connection,download ringtone mp3 files for offline use,STORAGE,,,
Offline download and viewingDedicated download manager,you can download download download,STORAGE,,,
You can save the videos and share them with your friends and family!,save photo to your phone gallery,STORAGE,,,
"Received coins, open tanks are stored on your device",access external storage,STORAGE,,,
"The new video avatar will be saved in memory, you can replace your old profile picture with the new one",you can take photo from gallery or take from camera upload to profile,STORAGE,,,
storage: pocket expense needs this permission to store data in your phone,save files to local cache storage,STORAGE,,,
storage permission is used to save user preferrence,this app access your phone storage,STORAGE,,,
Download and keep the beautiful HD artwork!,you can download,STORAGE,,,
"This package simply copies Bible audio files in the package into the Bible app default audio folder, i.e. ""audio4bible"" folder in the external storage",download mp3 files to device storage,STORAGE,,,
