Original Description,Synthesized Descritpion,Permission,Semantic Rating,Syntax rating,Length rating
It will create amplified versions of them in the Music folder on your SD card (or external storage),save mp3 files to your storage or sd card,STORAGE,,,
"Optional permissions Storage: Used to save or load health eating supported information, such as  photos or food photos ",save photos to your storage,STORAGE,,,
Just a tool for users save their media,you can save your photo and video files to your phone gallery,STORAGE,,,
"Large File function suggest deleting large files to free up storage, organize your storage space better ",app will delete large file to clean your storage space,STORAGE,,,
Select the path to save photos and videos More easy and useful functions are included in this free HD camera app,you can set a path and save files to destination folder,STORAGE,,,
"Share: send your robot, chipmunk, nervous or any other through your favorite chat app, save as ringtone, save to gallery, etc ",save your photo to phone gallery,STORAGE,,,
clean junk for more storage space,app will delete files to clean your storage space,STORAGE,,,
"You could compose a memo, take a photo or apply a picture from your gallery and share with others ",take pictures using camera or take image from gallery,STORAGE,,,
Required Permissions: storage - to save data on phone,this app will use storage permission to save files,STORAGE,,,
"With the image you can save the whole image, share the full image, or just save the image with the removed background ",you can save image to your device storage,STORAGE,,,
You can save the audio and use so offline,download mp3 to your device,STORAGE,,,
Move your recordings to an SD card and use it a default save location,you can set a path on your storage and save file in the folder,STORAGE,,,
SD card storage -- for storing the complementary phone camera pictures on SD card,save your photo to storage or sd card,STORAGE,,,
"Choose Image either from gallery or Camera, Save image to your SD Card ",open camera to take photos and take photo from gallery save to the the gallery,STORAGE,,,
Permission External storage : save and store your googly selfie,this app will use storage permission to save file,STORAGE,,,
"The photos/media/files permission is required to allow the game to save game data to external storage, and is sometimes used to cache ads ",this app use storage permissionn to save file to storage,STORAGE,,,
"If you are a professional photographer, HD Panorama will allow to save the input frames captured, and stitch and possibly adjust them on your personal computer ",this app use storage permission to save photo,STORAGE,,,
Save and view map images for the later reference by using included file explorer and image/text viewer,download files to your storage for offline use,STORAGE,,,
While you can preview events in the a Calendar Store app you need to purchase a yearly subscription to sync to your Android calendars (free 60 minute test available),app will add to your calendar,CALENDAR,,,
"Contacts/Calendar, so Offi can route you to your contacts or location from a calendar event, store a connection in your calendar or e-mail it to your friends ",this app will use read calendar permission,CALENDAR,,,
"Contacts/Calendar, so Offi can route you to your contacts or location from a calendar event, store a connection in your calendar or e-mail it to your friends ",app use read contact permission to read your contact,CONTACT,,,
Select mp3/music from your mobile or recordings,this app uses your microphone,MICROPHONE,,,
You can even record live audio and this MP3 editor can edit and trim the best parts from it,the app use microphone to record live audio sound,MICROPHONE,,,
You can even record live audio and this MP3 editor can edit and trim the best parts from it,this app will use your microphone,MICROPHONE,,,
Make your note/diary awesome with images/videos/audios,you can record your voice with device microphone,MICROPHONE,,,
Make your note/diary awesome with images/videos/audios,the app use microphone permission to to you can use to record your voice,MICROPHONE,,,
It is a smart sound recorder,this app use microphone permission to record sound,MICROPHONE,,,
You can use the microphone to test the words in the image,record microphone support,MICROPHONE,,,
"Can record video and take pictures in the background, even turn off screen ",this app will use camera and microphone permission,MICROPHONE,,,
This application needs to access the microphone to get the pitch you are playing or singing,record your practice using device microphone,MICROPHONE,,,
Record your voice using the built-in microphone,app use microphone you can use to record your voice,MICROPHONE,,,
Record an audio/music for editing,this app will use microphone permission,MICROPHONE,,,
The sound meter app uses your microphone to measure noise volume in decibels(dB),the app use your microphone,MICROPHONE,,,
"Change your voice in real-time after recording -- this voice processor makes your voice sound like a robot, an alien, a baby and many more ",record your voice using microphone of your microphone,MICROPHONE,,,
"Change your voice in real-time after recording -- this voice processor makes your voice sound like a robot, an alien, a baby and many more ",app use microphone and to you can record your voice,MICROPHONE,,,
HD Video recording,access microphone the microphone of your device,MICROPHONE,,,
Permission to record with microphone for visualization,this app use microphone of your device,MICROPHONE,,,
"This is required if your program uses the camera, Bluetooth, audio record, etc ",app will use microphone permission,MICROPHONE,,,
"Owing that performance of the microphone will be different for each device, so calibration is needed before use ",this app need access your micophone,MICROPHONE,,,
Sound detection mode,record microphone support,MICROPHONE,,,
It can record audio from mic as well during screen record,the app you to use your microphone,MICROPHONE,,,
"On Android, your child can view pictures, practice pronunciation compared to recording, learn pictures, and play a memory game ",this app will use microphone,MICROPHONE,,,
A very straightforward app that simply transcribes what's spoken to it,you can record your voice using microphone,MICROPHONE,,,
"Displays sound as a stream of color (live, microphone input) ",app use microphone microphone microphone,MICROPHONE,,,
Speak; record and listen your words,this app use microphone permission you can use to record your voice,MICROPHONE,,,
Record some fun words or phrases,app can record audio data,MICROPHONE,,,
"Easily raise your voice by singing or whistling while your draw, and watch the brush gets thicker or thinner, depends on how loud you are ",this app use microphone permission,MICROPHONE,,,
Record directly from your Android device,record microphone support,MICROPHONE,,,
This app plays the sound from the devices microphone through the headphones with a configureable delay,use microphone to record sound from your microphone,MICROPHONE,,,
SoundCheck evaluates your phone's audio capabilities for playback and recording,this app use microphone,MICROPHONE,,,
Display any sort of audio from the microphone as a coloured spectrogram,the app can record audio sound using microphone,MICROPHONE,,,
So funny recorder you will not stop recording yourself,app you use your device microphone,MICROPHONE,,,
"Change your voice in real-time after recording this voice processor makes your voice sound like a robot, an alien, a baby and many more ",record your voice using microphone of your device,MICROPHONE,,,
record sound from microphone,this app uses microphone permission to record,MICROPHONE,,,
"Record videos or take photos, is up to you ",this app use camera and microphone permission,MICROPHONE,,,
"HD filters Camera  is a fully-featured free Camera app, with Quick Snap and HD videos ",app uses camera permission to use camera,MICROPHONE,,,
The most technically advanced call recorder,access device microphone microphone,MICROPHONE,,,
Record your own sounds / voice and combine them into one big symphony with this looper / loop station,the app uses microphone permission to record your voice,MICROPHONE,,,
Both the microphone and the speakers can serve as audio input for the relevant patterns,record microphone support,MICROPHONE,,,
The application is suitable for practicing sounds in words and sentences,this app uses microphone,MICROPHONE,,,
The program will record your voice and then you can compare your pronunciation with a native speaker,you can use microphone to record your voice,MICROPHONE,,,
Voice Command Mode: take photo by voice command,this app uses camera and microphone,MICROPHONE,,,
Instant voice record playback,app will use microphone permission to record audio data,MICROPHONE,,,
"The sound recorder provides extra-long recordable time, and you can suspend the recording at any time ",this app use microphone of your device microphone,MICROPHONE,,,
the app uses gps to identify your location and also allows you to snap a photo or video to add to your service request,access your gps data to get current location,LOCATION,,,
access your location to provide ad service,access location information to get nearby ads,LOCATION,,,
access your current location to get nearby car rental positions,this app use your location information,LOCATION,,,
get gps location details,access location and gps data,LOCATION,,,
"access vehicle location, speed ",this app can get your current location and speed,LOCATION,,,
location: to help you find trips near you and providing maps,the app use location data,LOCATION,,,
all the messages are displayed on a live map with the exact location that they were sent,access location and gps data,LOCATION,,,
"feature supported by the precise location via gps, the position of the employees can be easily followed ",you can track location via gps data,LOCATION,,,
share your location with a checkin and see friends nearby,the app read contact to read contacts,LOCATION,,,
access your current location and get weather forcast.,get local weather in your location,LOCATION,,,
"in the application, you will find the locations of attractions, shows, restaurants, shops and services, navigate to the park plan ",access your location information,LOCATION,,,
real-time location tracking for field workers,app use gps data to track your location,LOCATION,,,
access your location  part of the maps/gps functionality,access location and gps,LOCATION,,,
remember to activate push notifications and geolocation,app read your location data,LOCATION,,,
find near-by properties by geo-location requires gps enabled device,this app can search nearby location using gps data of your device,LOCATION,,,
"display your current location, and share your current location on social network. ",access location and gps data,LOCATION,,,
find a safeway pharmacy near you by entering your zip code or using your current location,search using zip code or your location data,LOCATION,,,
customize the weather forecast for your community and other locations that interest you+ receive severe weather alerts at your location,you can get weather forecast near your location your location information,LOCATION,,,
location information is used for location based searches,access location and gps,LOCATION,,,
share your location,access your location and gps data,LOCATION,,,
share your location,the app will access your location and gps information,LOCATION,,,
"the location of each post, photo and video posted is logged via gps and made available to other runners to join in on the fun!",track your location via gps data,LOCATION,,,
find nearest vital locations,access your location and gps data,LOCATION,,,
app connects the drivers around your current location,this app use your location information to find nearby service,LOCATION,,,
"location based mute, turn the sound off when you go to the cinema or church ",access your location and location mute sound in church and cinema,LOCATION,,,
"along with navigation on the app, you can also find locations of different places around you ",access location and gps data to provide map navigation,LOCATION,,,
get the location when you take the picture,the app uses camera and camera to take photo and location,LOCATION,,,
"view the itinerary or event interactive maps with geo location and calculate routes to reach the points indicated in the different modes: auto, pedestrian or bike from your location ",get your location and set destination,LOCATION,,,
"the app is location-based and real-time, offering a map-based interface to the data available and the air quality in your neighbourhood ",the app access location permission,LOCATION,,,
location or the gps tracking function enable routing to and from the current location,this app can track your location via gps,LOCATION,,,
get your current location,access your location information,LOCATION,,,
access your current location,access your location and gps informtaionn,LOCATION,,,
"gps location is shown on maps during office hours, know where your staff is ",this app track your location using gps data,LOCATION,,,
see what's happening on your routes or around your current location,search nearby events using location information,LOCATION,,,
update car location,access location gps informationn,LOCATION,,,
easily choose your locations to get hourly conditions and 7-day weather forecasts,get local weather forecast based on your location,LOCATION,,,
"the app can detect your location, turn light on when your almost at home ",get you current location and calculate distance from home,LOCATION,,,
application features: geolocation,access location and location information,LOCATION,,,
tap on map icon on cinema list to get it's exact location,get distance from your current location location,LOCATION,,,
find nearby restaurants based on your current location,access your location data and get nearby service,LOCATION,,,
live tracking stream your location,this app can track your location via gps,LOCATION,,,
places gallery makes your picture browsing experience easier by auto grouping your photos by location,app can can use location and location data,LOCATION,,,
"through an interactive map system that detects your location providing not only the nearest stops, but all the lines that pass through each one of them ",access your location data and get nearby service,LOCATION,,,
location permission is required to deliver more relevant ads for players,access location and gps data to get location based service,LOCATION,,,
this app uses location services to display guests’ position on the map,this app use location information,LOCATION,,,
track gps based activities,the app use use location data track location using gps,LOCATION,,,
automatic location using gps with automatic update,access location and gps data,LOCATION,,,
use your location to automatically take useful actions while you're out,this app use location permission to track your location,LOCATION,,,
track vehicle locations,access your location and track location via gps,LOCATION,,,
save and track fishing locations- find saved locations with gps navigation system,the app use location data and location,LOCATION,,,
track your gps location information,this app uses location information to track you location via gps,LOCATION,,,
receive and update drive location,access location and gps,LOCATION,,,
get your current location and send it via sms,access location and gps information,LOCATION,,,
bus tracking - know the exact location of the bus in which your child is travelling in real time on a map,access location and gps data to track location on map,LOCATION,,,
premium navigation features turn-by-turn voice directions find places save and edit favorites locations  current location information,use location and gps data you can set destination and get direction,LOCATION,,,
stay connected to local news,access location data to get nearby service,LOCATION,,,
get real time location,access location and gps data,LOCATION,,,
get your taxi with a click and using gps,the app use gps data of your device,LOCATION,,,
find atms or bank branches closest to your location on the map,this app use your location and gps,LOCATION,,,
"search for cafes, restaurants, theatres and even hospitals with carefully organized location data ",access your location and gps data you can get nearby service,LOCATION,,,
find your nearest tcby location,access location and gps data,LOCATION,,,
we use geolocation so you don't have to enter your address,access location and gps data,LOCATION,,,
displays your exact location,this app use your gps data,LOCATION,,,
Employee location tracking: track gps location,access location to track location via gps,LOCATION,,,
"Securely backs up contacts, messages, call logs to Bkav Cloud or SD Card ",save contact and sms to storage or sd card,CONTACT,,,
read sent and received SMS messages,this app uses read sms permission,CONTACT,,,
"app can help you manage ringtone of contacts , assign different ringtone to each contact ",set ringtone to contact,CONTACT,,,
"Save as Ringtone/Music/Alarm/Notification, or assign it to a contact ",download ringtone and set as notification alert sms ringtone or contact ringtone,CONTACT,,,
"Set the new clip as default ringtone or assign to contacts, using this editor ",this app uses read contact permission,CONTACT,,,
Customize specific tunes for individual contacts or allow the app to set randomized tunes from your playlist for all outgoing calls,save contact to your phone contact list,CONTACT,,,
assign ringtones to your contacts,set ringtone to contact,CONTACT,,,
Mark important calls and filter them for quick access;- Call back and open contacts right from the app,this app use read contact permission to read contact,CONTACT,,,
"If you share a contact, a vCard will be generated on the fly ",save contact to file,CONTACT,,,
Make your life simple by scanning cost documents,this app use camera,CAMERA,,,
The smartphone camera captures a picture through single vision or progressive lenses and the app computes the refractive data in seconds,take picture with camera,CAMERA,,,
"Go ahead, take a Picture alone or accompanied and place within the selected background ",open camera to take pictures,CAMERA,,,
"Quickly measure the heights of buildings, trees, stomp rocket flights, etc, by first pointing the camera at the objects ",this app use camera permission to use camera,CAMERA,,,
With LiveTrip Traveller you can send live messages and photos during every journey via 3G/4G/WIFI,take photo or video with camera,CAMERA,,,
Barcode scanner,this app use camera to scan qr code or barcode using camera of camera,CAMERA,,,
The Sasbadi Annual Report 2016 app enables readers to experience features of Sasbadi's annual report in Augmented Reality (AR)enjoy Sasbadi's in-house AR technology,this app use camera permission you can use camera of your device,CAMERA,,,
Use our app to scan the barcode and order from your phone,this app use camera to scan qr code or barcode using camera of camera,CAMERA,,,
Use our app to scan the barcode and order from your phone,app can use camera permission,CAMERA,,,
Signature and image capture Bar codes,the app uses camera permission to take photo,CAMERA,,,
"scan functionality for QR-codes, scan QR-Codes on the visitor badges and import this data in your contacts ",this app use camera to scan qr code or barcode using camera of camera,CAMERA,,,
Create a phenomenal collage out of your private photos If you are a person who takes a lot of pictures and likes making selfies,the app use use your camera,CAMERA,,,
Start scanning your tickets today with ScanFastInstall the app to turn your Android device into a fully functional ticket scanneryou'll be ready to verify barcodes on all types of tickets for your events,the app uses camera permission,CAMERA,,,
Voice and video calls to mobile devices and computers,this app uses camera permission to use camera for video call,CAMERA,,,
"Bring LumiSpa to life with this cool augmented reality appscan a LumiSpa AR image, and watch as a 3D projection of the new ageTry snapping photos or recording video of you “using” your new digital device—all in the app!",access your camera to take photo or video,CAMERA,,,
Take new photos of receipts or choose existing photos,open camera to take photo or select photo from phone gallery,CAMERA,,,
Anarkali Dress Photo Suit is photography application to set different Anarkali Dress on your face by live capturing OR per-captured photos,the app uses camera of your camera,CAMERA,,,
you can record this lecture or take some pictures or even adding notes or taking some videos,take photo or video using camera of your device,CAMERA,,,
"Users have one identify across all services, voice, video and Instant Messaging & PresenceVoice and video calls are enhanced with the highest quality voice ",you can use your camera to start video call,CAMERA,,,
Automatic scan of voucher's QR code,use camera to scan qr code or barcode,CAMERA,,,
Login via QR CodeLogin effortlessly by scanning the QR code,the app use use the camera permission,CAMERA,,,
Flashlight on call is a free to download smart app which will blink flash light on callEven when your mobile mobile is in silent mode you will be intimated about a call through flashlight blink by using this flashlight on call,access camera of your device camera to use flash light of your camera,CAMERA,,,
Take or upload a picture of a receipt and submit for a new or existing claim,take pictures using device camera,CAMERA,,,
Place it over photo from gallery or shot a new one,take pictures using device camera or choose from gallery,CAMERA,,,
"take a photo or select from image galleryOpen this latest photo face changer on your smartphone, select picture from your image gallery or capture a new selfie",take photo selfie with the camera of your camera and you can take image from gallery,CAMERA,,,
AR Christmas app lets you experience the season of love through Augmented RealityIt makes the traditional Christmas card comes alive,this app uses camera permission to use camera,CAMERA,,,
"The app allows you the parent our caregiver to capture imagesYou simply take a picture of an object, place, or person and apply the appropriate text ",take pictures using device camera or choose from gallery,CAMERA,,,
"Collage Art brings you a variety of awesome features to help you create beautiful works of art from your photosUse a wide range of features and effects to spice up your picturesAdd emoji face stickers, love stickers, friendship stickers and more! ",take pictures and add effects on your photo,CAMERA,,,
QR code scanner and passcode features to easily connect with new communities and events,you can use camera camera to scan qr code,CAMERA,,,
"You can make a video call for free with the most used face call apps such as Whatsapp, Messenger, Skype, Bigo Live, Imo, Kik, Tango, Viber, etc ",this app uses camera permission,CAMERA,,,
also allows you to snap a photo to add to your service request,take pictures with device camera and camera,CAMERA,,,
"You simply snap a picture, enter a few details and you’re doneJust snap a picture and sell it on Pxsell ",take pictures with device camera and camera,CAMERA,,,
QR code verification tool for Folio,use camera to use you can scan qr code using camera,CAMERA,,,
Deploy services on new computers by simply scanning a QR code with this app on the local computer,open camera you can use use to scan qr code or barcode,CAMERA,,,
Take a beautiful selfie of you or Choose a photo of anyone else you want from gallery,take photo or selfie with camera or select photo from your phone gallery,CAMERA,,,
20+ well-designed video styles for you to edit and record unique moment,this app uses camera permission,CAMERA,,,
The app allows you to scan a QR code that matches a label for your business,open camera you can can scan qr code and barcode using camera of camera,CAMERA,,,
KalTicket Pro allows your ticket salesperson to scan tickets with QR code at the entrance of cinemas or theaters,can scan qr code with the the camera,CAMERA,,,
It is an easy and fun way to enhance your personal photos and Changer yourself in dancer,save photo to gallery,CAMERA,,,
Transcribe written notes – from a photo of your padCreate Outlook contacts – from photos of business cardsDo expense reports – from photos of receipts and a spoken description of the tripEnter records in a database – from a photo of a form,this app uses camera permission to take photo,CAMERA,,,
"Even better, its high-speed HD video and audio chats bring more life into your conversations with your friend(s) ",start video chat using device camera of your camera,CAMERA,,,
Upload photos,this app uses camera permission to take photo,CAMERA,,,
Augmented reality is about to get augmented,access device camera to activate,CAMERA,,,
"We also collect images, signatures, audio, dates and times, QR codes as well as many advanced feature rich enhancements that are being added by constant development ",this app access to your device camera,CAMERA,,,
Type or scan a VIN in order to stock in off lease inventory,open open camera to scan,CAMERA,,,
"you’ll be connected through a secure, video chat with a licensed, local doctor ",the app need camera permission to use use video chat,CAMERA,,,
"Modify flashlight notification app for android with deferent colors white, purple, pink, Yellow, green, blue, redNow available flashlight app for sms texting and calling ",the app uses camera permission to use flash light of your camera,CAMERA,,,
If you love taking pictures with your children and you want to do something special with themChoose a photograph from your device or take a new one,take photo with camera or take from phone gallery,CAMERA,,,
