pp,ui,cg,des
camera is used in real time.,open camera tap or press for photo or video,get camera open open camera take picture run start start recording video pause resume stop video recording,"Tap to take a photo, or press and hold for video"
Our products may request your permission to access your smartphone's camera to take picture.,take picture gallery select cancel,get camera info get camera open camera take picture,Can choose an image from the gallery or taken from the camera.
he applications access the camera only when the user activates barcode scanning with the built-in camera.,start camera,get camera set set run open camera scan start,Barcode scanning with built-in camera supported
"The images you take using camera, or if you use any image from gallery, will remain inside the app only, we do not have access to any of your images.",tap camera icon to start,click create view holder unbind icon set click listener set set icon take picture save,Take better photos is one of the best selfie camera app with multiple features
"When you elect to??allow it, some of our mobile applications have access to??the??camera.",start camera,start get camera device id set torch mode,This app need access to your camera.
Camera permission allow us to to take pictures and create videos through the permission Camera????which is granted by user for photo effects and video play pause or for photo frames effects or may be to save and share his/her pictures.,Add Text Font Colors Layout Background Border Add Filter Add Effect Add Frame Save Cancel Share,capture open camera take picture add text add tag choose font save,Directly import photo from gallery or quick access from camera for 3D text
This app need to access to camera to take photo.,Add Text Font Colors Layout Background Border Add Filter Add Effect Add Frame Save Cancel Share,create action view set action update menu view icon click take picture,"Take beautiful selfies anytime, anywhere by applying filters and that too in silent mode Apply best amazing and fantastic filters to your selfies on live camera Save photo and share it"
"The app may also request access to sensitive permissions, for example, your device camera.",start camera,get camera set camera parameter get camera device,"Open the application, press ""Start"", and point the camera."
Measuring data inferred from camera. Note that camera is only used in measuring. The camera is not used for any other purpose in our app. ,Take Picture,touch event start camera auto focus capture take picture,"Capture picture with camera, Calibrate, Measure in different modes"
This app will need permission to access your device camera.,take picture gallery select effects apply cancel,open camera capture take picture,Select photo from your phone gallery or take photo by using the camera
"Our applications will use camera information, and process the photo you take, add some special effect on the photo as you want. Then you can view the processed photos in your photo browser or in our applications.",select camera take photo landscape mode portrait mode night mode ,tick touch event take picture shot ,"Take photos, selfies, portrait using device camera."
"Access to the device's camera allows users to take their picture, and upload it as their profile picture on our portal.",select contact start video chat,set click listener click get device get camera run open camera,Open camera to have a live chat with your friends.
Used for camera permissions that are associated with accessing camera or capturing images/video from the device. This permission allows this application to capture the user selfies in order for them to be viewed in a timeline within this application.,scan canncel no barcode detected,start run prompt open camera ,Use camera and scan QR code.
"The application may use the device camera to take pictures as part of its main feature. If used, the camera will operate only when activated by the user.",open camera effects color filter save cancel,set click listener click get camera open camera take picture set effects set color effects set filters save,"This app is using the device camera to take photographs and add colors, filters and effects"
Our apps may request permissions to use data from camera sensor and microphone. This data is handled as personal and sensitive information and our apps will not send camera/microphone data from your device unless you explicitly share a photo or video using the sharing functions of the app.,welcome tap camera icon to open camera,create view click take picture,Use your camera to take pictures.
We also use the camera to upload the home works by clicking the blackboard or printed text.,Open camera,set click click take picture,Taking picture of your homework using camera device. Upload the photos.
Camera permission is required for the game engine to establish View Port to generate common resolution in all the app by computer generated graphics.,Take Picture,picture taken set click listener click take picture,"Choose your tattoo design, take a picture and check it out inside app gallery."
some Apps may include functionality which allow you to take a picture using your camera or use your microphone to make a recording.,Effects Frames Apply Cancel,open camera capture take picture,Take pictures using your device camera and apply different effects.
Camera permiision is used for accessing the camera or capturing images and video from the device.,tap camera icon to start,set content set view click scan get camera open camera open camera,Open camera to scan.
"Some of our applications may use camera to take photos and videos and turn ON and OFF Camera Flash, when you request. We do not save or upload your photos/videos.",gallery open camera,get camera set camera parameter set click listener click take picture,Edit photos from gallery or photos taken from camera.
This app uses your camera only in so far as getting the UPC code to match the product accurately. ,scanning,set click listener click scan setup camera get device get camera open camera run,Open camera and Simply scan the barcode of a product.
"This permission help us to get an image from your camera, and take picture from your smartphone camera.",select photo open gallery open camera choose effects,click get device get camera open camera take picture set effects set color set white balance,"Decorate your photos with these incredible frames, choose a photo from the gallery or take a photow ith the camera, then apply the frame ,effects, sticker and text."
This app requires permission to access your camera.,select camera take picture open gallery,set click listener get cameras select rear front camera click take picture,"Whether you use your front or back camera, you can shoot the best pictures and make them even better."
Required to be able to access the camera device. We use your device?€?s camera flashlight and require camera permission.,take picture open gallery,set click listener run set size set buttons listener take picture,capture photo from camera or choose from gallery.
Some of the application may request your camera data. It is used to capture for the purpose of editing and we don?€?t share any photo data with anyone or any other app or person.,Open camera,start run scan get camera open open camera open camera run set view,"Simply open the app and put the camera in front of the focal point of screen, scan the QR code."
Access to the camera is used only to scan the bar codes. We do not use cameras to collect any personal information.,Open camera,set content view get device get camera open camera,Use camera to scan QR code.
"permission CAMERA: To take picture to decode QR code and barcode, this is main feature of the app.",scan put qr code in the center of the screen ,get device get rear camera open camera,QR  code  reader  is  designed  with  the  permission  of  the  camera  to scan.
this app might access your device's camera to let you take a new photo or access photos or videos stored on your device for editing,Start Video Choose Contact Start Cancel,get device get camera open camera,You can have video chat with your friends and family members.
"Access to device camera To take picture to decode QR code and barcode, this is main feature of the app.",start camera,start run get device get camera open camera run ,QR  code  reader  is  designed  with  the  permission  of  the  camera to scan QR code.
This app request permission to access your camera.,Open camera,get camera run scan open camera,Scan product QR code or barcode using camera on your phone.
Some of the application may request your camera data. It is used to capture for the purpose of editing and we don?€?t share any photo data with anyone or any other app or person.,Open camera,get device get camera start open open camera run ,you  turn  on  the  app  then  watch  QR  code  or  Barcode  by  camera
Some of our App uses this permission to open camera from our App and take pictures and use directly into our App. Also some of our App uses this permission to turn On/Off flash light.,capture image of new break in,get camera open camera click take picture,This  app  requires  camera  to  provide  you  intruder  selfie  functionality  and  take  photos  of  intruders.
"Activate the GPS tracker to trace your performance on the slopes. Measure your maximum speed, average speed, time, altitude, distance with our without an internet connection ... Locate your friends in the resort, challenge them for a run and find out who's the best skier!",get current location enable tracking search open map navigate ,get current location get latitude get longitude enable search set destination get distance calculate distance request map set click listener click open map run background get last known location ,"In few clicks, you have access to all live information from the ski resort of your choice as well as the GPS tracker to record your activity on the slopes! "
"When you use the App and with your consent, we may collect and use your precise (or GPS) location information collected from the App to enhance your use of the App by providing you with sessions and meetings nearby.",get location,location get altitude location map get current position get last known location ,Create your own personal schedule and access location and speaker information
"When you visit the mobile application, we may use GPS technology (or other similar technology) to determine your current location in order to determine the city you are located within and display a location map with relevant advertisements.",start tracking get GPS,run get accuracy start tracking run get longitude get latitude save current location,Track your location.
When you use the Services we may collect your precise location data. We may also derive your approximate location from your IP address.,get location,get last known location get altitude get speed set,Make search based on your location.
"When you use our free mobile GPS applications, we may use GPS technology (or other similar technology) to determine your current location in order to determine the city you are located within and display a location map.","""Touch at anywhere on the map to mark 'Start' and 'End' Location!"" set driving route",select travel mode add destination location get current position get routes request map click start map run background,"a GPS based route finding app you can use it for accurate GPS location, detailed maps, nearby POI places, routes, route preview and instructions"
"In the event that location sharing is enabled in the application, the mobile product also allows us to collect information about your location or the location of your device using the GPS coordinates provided by your mobile device",geolocation This shows your location on the map my location,request location get best provider get last known location get current position ,Possibility to create a route to the desired location
"When you visit the Subsplash mobile application, we may ask you to opt in to allow us to use GPS technology (or other similar technology) to determine your current location for purposes of reporting on user activity and engagement.",get location find nearby events,create location service set longitude set latitude set click listener click check events nearby start search delete service restart search,Find events near your current location.
"When you visit the mobile application, we may use GPS technology (or other similar technology) to determine your current location in order to determine the city you are located within and display a location map with relevant advertisements.",get location,get last known location apply day night night connected get night mode apply get latitude set local night mode update state map night mode yes,We have a wide range of homes in Ponferrada and nearby locations
"In serving you, we may use GPS technology (or other similar technology like GLONASS) to determine your precise geographic location, in order to give this information to the users you have authorised for that and provide relevant services to them.",start tracking get GPS,get last known location request update location get longitude get latitude run start logging write file,Real-time GPS tracking and trip history
"The app uses GPS to determine your precise location  when you display your location on the trail map, or track your location during runs. Your precise location is also  used if you share your location.",enable gps start tracking,get last known location request location update set current location get longitude get latitude,Location and tracking services require a GPS-equipped phone
"When you use our free mobile GPS applications, we may use GPS technology (or other similar technology) to determine your current location in order to determine the city you are located within and display a location map.",your location setting routes start voice gps navigation,start location sensor start navigation item selected get latitude get longitude set destination check route start map service run background,"Plan your travel with GPS Driving Route, a GPS based real-time voice navigation app which supports online / offline maps, search, optimised routes, traffic signals, speed cams, compass directions, parking, trip recording"
The app uses the GPS only if you create Longitude and Latitude columns. This data is only collected and saved to your database only when you request it.,choose a type monument city beach mountain park add to record file,run get longitude get latitude get last known location,"record GPS coordinates of the places you visit, like monuments, cities, beach"
"Location Based Services (LBS, GPS, location data) are used in the app to reference the location against a location area specified by the service provider. ",get location,get location fetch gps data get longitude get latitude check update location,Access GPS data.
"Geo location data, which is any Information which indicates the geographical position of your device and which may include the time the location was recorded, and may include precise (e.g., GPS-level) location data. ",get location,get last known location provider request map record current location get longitude get latitude tag photos with location,Gallery can take photos and record the location where you take them You can manage your photos and pictures by different folders or by location
"When you visit the mobile application, we may use GPS technology (or other similar technology) to determine your current location in order to determine the city you are located within and display a location map with relevant advertisements.",current location current mileage find vehicle relocating vehicle location previous location set new location start tracking please enable location feature in your settings,get latitude get longitude dispatch time start ensure auto night mode manager map night mode apply day night get night mode,The service option of GPS-tracking of transportation routes simultaneously use the data obtained from the mobile devices with built in GPS.
"We may collect your location information to add geo tags to the photos and videos you take on our services. With your consent, we may collect such information through GPS, wireless network, wifi network, etc. You can revoke your consent or turn off geo tags by changing your location permissions in settings.",get location add tag,run backgroud get current location select photo tag location set,tag your photo with the location.
"When you open the Application, we may use GPS technology (or other similar technology) to determine your current location and display a location map.",get location navigate to,get last known location start map navigate request location update get current location get longitude get latitude,this app will display the current location for faster navigation to the free wifi station
"When you use the mobile application, we do use GPS technology (or other similar technology) to  determine the device speed, this is the core functionality of the application.",get location,request location load engine enable location sensor get speed get time get request map get latitude get longitude background run get last known location ,"Just launch the app, wait for a couple of seconds for the GPS to lock and you are ready to go, monitor your speed on the map"
"Location data are used to provide the user with information about cultural assets and events in his proximity. Location data can be stored and subsequently analyzed to provide better and more accurate location services, also based on the user preferences.",get location,location package get accuracy get current place get location get last known location map,Geographical location to easily visit the cities;7
With respect to the Personal Data used in the Service we only collect IP Addresses and certain coarse geolocation and Internet Service Provider information associated with that IP Address.,Latitude Longitude Start Logging ,start location run start get latitude get longitude stop location set loatitude set longitude,Get your location based on your ip address.
"We may collect and process your location data to provide location related Services and advertisements. For example, some add-ons or offers may be available at dedicated locations. The location data is processed?? and stored only for the duration that is required for the provision of the location related Services.",get location,get location click start click get last known location set longitude set latitude fill location create advertisement manager,This app use location information to provide relevent service.
"In some cases we collect and store information about where you are located. This may be accomplished by converting your IP Address into a rough geolocation, or by requesting location information from the device you are using to access the Services.",get current position,check get current position event listener added use update location get provider ,This app uses your location and gives you a menu of common quality-of-life conditions to choose from in your service request
"As an integral part of providing the Services, we may use GPS, or other technology to collect geolocation data that tells us your current location.?? This allows us, for example, to assist you with finding parking, or provide you with an interactive map of the park.",get location find nearby events,location package get accuracy call location outside fence location get current place log play event call log play event ,"Everything you need to make your day at Canada's Wonderland the best day ever!The app uses your location to keep you up to date with offers, events and activities relevant to your location"
"Track the distance covered, working duration, battery percent, real-time location, GPS position of your executives. Play their entire route with the click of a button.",show on map,get hire marker get worker current location menu selection hire available,Lystloc is a location intelligence solution that helps organizations to track their employees and vehicles in real-time easily
"Certain features available in the Service may allow or require us to obtain your location information, including GPS coordinates in real time (?€?GPS Location?€?).",get location,get current location background get last known location share get contact select send,Detailed maps with your GPS location Send your current location to friends or family via text message or email.
"Our apps offer GPS directions to the organization or any other locations placed in the app. In order for the GPS feature to work, the app needs to use the GPS system on your device.",get location,build table view click get last known location run run start activity result get current location click listener show multiple show location available,App features include GPS directions.
"When you use a location-enabled Product or Service, we may collect and process information about your actual location, like GPS signals sent by a mobile device. Further, we may also use certain technologies to determine location, such as sensor data from your device that may, for example, provide information on nearby Wi-Fi access points and cell towers.",start location get current location set destination track driver,get last known location request location update set destination request map display traffic share location select contact ,"Get real-time GPS navigation, traffic and explore nearby places, and you can share you current location."
"Depending on the Crises Control services that you use, and your app settings or device permissions, Crises Control may collect your precise or approximate location information as determined through data such as GPS, IP address and Wi-Fi. We use location information for safety and security reasons to know your approximately location, who is closest to an incident and user's locations in relation to the incident.",get location,get last known location apply day night set local time get time,"Incident location, who to contact, supporting media and/or documentations."
"This app automatically detect or infer your location using GPS, your IP address, watermarks, but often your operating system will require you to grant RBL permission to access your GPS",get location,get accuracy get longitude get latitude get time,RECORD_AUDIO & COARSE_LOCATION: This is required to analyze offline TV viewing data and serve media-targeted ads
We collect general location information (e.g. your physical or postal address or your device?€?s IP address) or more specific location information (e.g. precise location from your mobile GPS) when you use certain features of our services. ,get current location locating breaking news get weather ,get current location find news article share create measurement get weather ,"Customise alerts for breaking news, location and interest-based notifications  ?€? Set your weather based on your geo-location or chosen location"
"This Privacy Policy applies to all our websites, mobile or tablet applications, including GPS, Disc Golf, Handicap, and Toll Calculator apps.",get location,get last known location get longitude get latitude receive start navigation update location run background,Option to calculate route from current location using GPS
"When you install the Applications, you may be requested by the Device operating system to provide your consent to the use of your location by the Application.",get location,get request map get longitude get latitude load ad get time get bearing location get distance,Application tracks your distance and bearing from a given memorized gps location
"We may collect automatically Location information that allows us to periodically determine your location, including your location relative to and within third party merchant locations.",get location,get longitude get latitude get time get accuracy better location get last known location track location request location update,* `FindMe` displays your exact location and `Auto Tracking` displays your movement on the map (this feature is not supported on devices without built-in GPS hardware)
The location data collected through an app depends on your device settings and app permissions. ,get location,invoke request single update get current position get latitude get longitude,Access location and speaker information at your fingertips
"Used for accessing the User's approximate and precise device location. This Application may collect, use, and share User location Data in order to provide location-based services.",From station To station Leaving after Arriving by Plan Trip ,get last known location get latitude set latitude get longitude set longitude find get distance,Location based station and stop finder
"We may also collect location information, such as your device GPS coordinates, unless you configure your device operating system settings to prevent our collection of location information.  We use this information to enhance the services we offer, provide targeted advertising, and to help us understand how people use the Site and Services.",get location weather,write parcel location transact set mock location start get time set latitude set longitude ,Immediate access to your nearby Muni stops based on your location Current weather conditions in San Francisco
"For mobile issues and service requests we will use your GPS information, or the GPS location you provide, to help us identify the location",get location,start location set click listener get location resume run provider require location update update location address display location send location,"Just select your issue, and take a picture - the app knows the location and sends it right into the city's CRM or 311 System"
