pp,ui,cg,des
"The App will access your phone contacts and export them using one of the following methods: Send them as an email attachment to a destination of your choice. Save them as a file in the storage of your phone/device. Transfer them to the Site, as an intermediate stop for another phone/device.",Import Contact Contact Transfered,import contacts create new contact insert contact name insert contact photo insert contact address,"This app can import, export, and transfer your contacts."
"Interactions that you have with other users or content on the Service, and When you give us authorization, contact information of your friends from your mobile or tablet devices to connect your contacts and address book information with your Clikon account.",Please grant Clikon permission to access contacts on your phone Add to Favorite Save Contact ,selection string add print stack trace get activity build hide soft input window click value apply batch trim get context length set text get window token get text get current focus get system service dismiss get content resolver new update set visibility ,syncs  with  contacts  and  you?€?re  ready  to  go. add  your  favorite  contacts  in  app  home  screen  to  make  the  call  within  a  couple  of  touches.
"JHINGUR.online may collect information from you, this may include technical or other related information from the device used to access JHINGUR.online including without limitation contact lists in your device",To body send ,click run create contact group,it  will  not  read  your  contacts  saved  in  phone  but  you  can  create  separate  contact  list  so  that  contact  would  be  added  in  jhingur  as  your  preference.
"we collect the automatically given information provided by Facebook such as public profile, friends list and e-mail. ",Set As Ringtone Set As Contact Ringtone Set As SMS/Notification Set As Alarm Tone Set Timer Credits Author name treba ovde ,click set ringtone assign contact get contact ,Set  sound  as  default  or  contact  ringtone
Permission to access contact information is used when you search contacts in zHorizon Apps.,Caller Id,receive information get contact get caller id get caller name,Read  contacts:  To  read  the  device  contacts  to  provide  caller  id  information.
"Application uses contact permissions: Contacts (read your contacts) - connecting Your contacts with profiles (name, avatar, sending reports)",Add contact to fill this list,click add people add contact name add contact photo,"Contacts  (read  your  contacts)  -  connecting  Your  contacts  with  profiles  (name,  avatar,  sending  reports)"
Yabb may periodically access your contact list and/or address book on your device to find and keep track of mobile phone numbers of other users of our Service. You hereby give your express consent to Yabb to access your contact list and/or address book for mobile phone numbers in order make a copy of the phone numbers and names in your address book,Invite Contact Select,set click listener click get contact details get contact name get contact number,Find  contacts  who  are  already  on  Yabb  and  invite  those  who  aren?€?t.
Yabb may periodically access your contact list and/or address book on your device to find and keep track of mobile phone numbers of other users of our Service. You hereby give your express consent to Yabb to access your contact list and/or address book for mobile phone numbers in order make a copy of the phone numbers and names in your address book,Add to existing contact Create new contact Contact Auto Sync,add number perform sync contact list,Easily  add  friends  to  your  contacts  list  with  Yabb  Auto-sync.
This includes our use of the data that our Users provide us in order to enable our Users to use the Services to communicate with their contacts.,Import Contacts Select Google Contacts Local Contacts File Start Import Cancel,click import items get contact,"Contacts  Import:  Import  business  contacts  from  Google  contacts,  phonebook  or  excel  sheet."
"The app has access to your contacts, but it doesn't store this information in local database and use it only while shortcut creation.",Select Contact Contact Shortcut,get contact list ,Read  your  contacts  is  required  for  selecting  some  contact  which  will  be  used  as  target  for  a  shortcut.
we request access to your contacts stored within your Device to help you find your friends on the Services and access to your music library on your Device to help you find the music you love.,Searching?€? Please use 2 or more characters when searching. ,click execute background get contact phone number get contact background ,Use  your  contact  list  to  invite  friends  to  events  or  find  friends  already  using  Bandsintown
"If you choose one of the options (share, more apps?€?) that you may encounter in the application you will give the permission for Social Networks and other Portals to collect the information about you. They will have the access to your user name, contact data, and the rest of data that could be found in your profile account.",Cut Tools Ringtone Contact Ringtone SMS Alarm Favorite ,click assign contact get contact list open input photo stream,Assign  different  melody  for  every  contact
"Contacts permission Used for accessing contacts and profiles on the User's device, including the changing of entries.",Favorite Contacts Contact Info,read contact get conntact list get contact name image dummy main method start command ,Slide  a  contact  to  left  to  call  or  send  a  message  directly and quickly  call  your  favorite  contacts!
"Should Islamic Apps request and collect any of the following permissions or sensitive user data: microphone, camera, accounts, contacts, or phone, the data will be handled securely",Quran Mp3 Ringtones Set as ringtone Set as notification Set as contact ringtone Set as alarm tone Ad Get more apps Share this super cool app Privacy Policy ,get stream get contact photo stream get stream content set ringtone for contact,"Set  as  a  ring  tone,  SMS  notification  alert,  alarm  sound  or  assign  it  to  specific  contacts"
Read contacts to Retrieval of data for displaying the upcoming birthdays of your contacts.,Settings ,get contact create birthday notification ,"READ_CONTACTS  to  read  your  contacts, Home  screen  widget  displaying  the  upcoming  birthday  and  anniversary  dates  of  your  contacts"
Our service also need access to your device contact to add people from your device address book to skype contact list,video chat call select contact share,start call invite get contact ,"Simply  tap  on  the  call  tab  on  Skype  Lite,  and  start  the  group  call  with  your  friends  on  Skype  Lite.  You  can  also  share  a  Skype  Lite  group  call  link  with  your  friends  on  popular  social  apps  like  WhatsApp,  Facebook  Messenger  or  SMS,  and  invite  them  to  join  the  call."
The ContactsPoint App provides a way for users to import their contacts from an old mobile phone into the Smartphone where the App is installed and used.,Import Contacts Contact transfered from your old device,process queue save contact run ,This  application  allows  you  to  transfer  within  a  few  seconds  all  your  contacts  to  your  new  phone.
"For a better experience while using our Service, I may require you to provide us with certain personally identifiable information, including but not limited to address camera, location contacts and storage. ",Contact Generate QR Code ,click launch contact activity create qr,"Barcode  and  QR  scanner  can  scan  and  read  all  QR  /  barcode  types  including  contact,  email,  and  many  other  formats."
The numbers to be contacted are downloaded to the phone and dialed using the native dialer.,Name Telephone ,start activity result click get contact info,"Activate  your  astDial  account,  upload  contact  on  cloud"
"The App ?€?SWYNC?€? (hereafter ?€?App?€?) is a platform for the synchronization of contact data of users. The regular updating of his/her data is the only task the user has to do; the App synchronizes them with the data of the other users in the user?€?s address book. In order to guarantee the functioning of the App, it is indispensable that the App gets access to contact data/address book of the user?€?s device and that the users keep their data up??to??date.",Loading contacts Add Contacts ,get contact information get contact id modify contact delete contact insert new contact,"The  phonebook  Contacts  App  helps  you  to  modify, delete and insert contact."
"VshGap can optionally discover which contacts in your address book are VshGap users, using a service designed to protect the privacy of your contacts. Information from the contacts on your device may be cryptographically hashed and transmitted to the server in order to determine which of your contacts are registered.",Create Group Add Select Contacts Start Group Chat Invite Contacts Share with Contacts,load resource get contact open contact photo input stream ,"You  can  send  an  unlimited  amount  of  messages,  photos,  videos  and  files  of  any  type  to your contacts and have group chat with up to 200 contacts at a time."
"Contacts: Some of our App(s) uses this permission to provide some functionalities such as view or edit existing contact(s), add new contact(s) or delete contact(s) as per your action taken from our App(s).",Contact Details Name Address Phone Number Share Contact Add Favourite Contact ,click activity result get contact data get contact details get name get address get phone number set click listener click share contact set click listener click add favorite,This  app  uses  Read/Write  Contacts  permission  to  read  contacts  per  your  action  taken.
"Contacts: Some of our App(s) uses this permission to provide some functionalities such as view or edit existing contact(s), add new contact(s) or delete contact(s) as per your action taken from our App(s).",No Contacts Found Click on + button to add contacts ,set click listener click add contact append update set text get content resolver ignore case value ,This  app  uses  Read/Write  Contacts  permission  to add/delete  contacts  as  per  your  action  taken.
"READ_CONTACTS, WRITE_CONTACTS: for internal use for the purpose of assigning the ringtone to desired contact",Set ringtones for contacts Select Contacts Save,click set ringtone assign contact get contact by name,"READ_CONTACTS,  WRITE_CONTACTS:  for  internal  use  for  the  purpose  of  assigning  the  ringtone  to  desired  contact"
"We may request access or permission to certain features from your mobile device, including your mobile device?€?s contacts, and other features.",create contact csv file update import contact from file,start call resume start next selected call update list view selection post execute post execute start task handle result post execute start next call get selected contact call context item selected handle call record result get post execute set current call ,You  can  import  thousands  of  contacts  into  separate  groups  from  a  spreadsheet  (CSV)  in  seconds.  The  contacts  are  synced  real-time  from  your  computer  with  your  Android  app.
This app(Multilanguage Keymap Redefiner) use ?€?android.permission.READ_CONTACTS?€? permission. This permission needed for autocompletion when you are using on screen keyboard.,Use names from Contacts for suggestions and corrections,get contact info get contact name,READ_CONTACT  permission  needed  for  autocompletion  when  you  are  using  on  screen  keyboard.
"Contact Permission: Access to get contacts id. Through contacts id, one can set Contact image URI(Uniform Resource Identifier) and set Ringtone audio URI Directly from application.",Backup Contact List Restore ,get photo background execute background click fetch contact id phone number get photo ,"Recover  Deleted  All  Photos,  Files  And  Contacts."
"Should Customize My Phone request and collect any of the following permissions or sensitive user data: microphone, camera, accounts, contacts, or phone",Horror Ringtones Scary Sounds Set as ringtone Set as contact ringtone Set as notification Set as alarm tone Share this super cool app Get more apps ,get stream get contact photo stream get stream content assign ringtone contact save update,"Set  as  a  ring  tone,  SMS  notification  alert,  alarm  sound  or  assign  it  to  specific  contacts"
"AHS Studio may ask its users to allow access to various features of their smartphones such as camera, microphone, contacts and location solely for the purposes of aligning with the features of our services and products.",Add To Favorite Cancel ,set click listener execute click get contact list add to favorite,You  may  create  favorite  contact  list  for  privacy  or  may  put  contact  list  in  the  privacy  to  secure  your  contact  while  ring.
Need personal data such as contact permission,Contact info on your device ,set click listener get account get detailed contact list click get background get contact cursor get contact cursor execute open account file update data bound share click ,Edit  contacts  and  add  notes  to  the  people  you  meet.
"Our application get user's family/friends phone number and save into the application, Which means it makes the user to enter the individual contact to store in the application",Select Contact Show Contact Numbers,activity result get contact details get contact number display,Mobile  Tracker  App  uses  permission  to  read  the  contact  and  make  user's  to  pick  individual  contact  to  store  in  the  application  and  display  picked  contact  numbers  when  user  get  in  to  this  app.
"The Application requires permission to get user contact list to share resources (people and their info, ex. phone) among projects.",Share Choose a Contact Choose a Phone Number,click share get contact open input stream,PERMISSION  for  reading  contacts: It  allows  you  to  share  the  same  resources  accross  multiple  projects.
"This type of service makes it possible to manage a database of email contacts, phone contacts or any other contact information to communicate with the User.",Import Contacts,activity result set click listener click get contact details,Import  persons  from  your  contacts  or  a  Google  spreadsheet
We Read your contacts: Revolutionx Apps does not save or upload your contacts.,Announce Caller Name Announce Sms Sender Name Announce Sms Content Volume Languages Settings Do not annpuncer list More apps Rate us ,retrieve contact number activity result get contact name announce receive get stream get contact photo stream get stream content ,You  can  create  list  from  your  contacts  to  exclude  them  from  caller  name  announcement. Calling  person  name  if  exists  in  your  contacts.
Accessing device contacts to use the function of importing phone contacts and saving card to contacts,Contact Info Company Info More Loading?€? ,save phone click replace cam card system contact save account get provider execute system v card entry background save get device account type click get device id,"Easily  export  contacts  to  Salesforce,  SugarCRM  or  save  as  Excel  files"
"With your permission, we may also access other personal information on your device, such as your phone book or calendar, in order to provide services to you.",New phone number Add new contact Ignore ,show contact list get contact add new contact update append set text set get content resolver,"CREAM  assistant  is  also  a  base  of  your  contacts,  which  can  be  quickly  created  and  organized."
We request access to your contacts to display a local contact list inside the Teo Softphone,select contact assign ringtone,get list phone number get ringtone get phone number get data cursor get contact save,Set ringtones avatars for your contacts.
Some of our applications may use this permission to read your contact information when you request. We do not collect or share this information. We use this permission to announce caller name or to display dialed / received calls / missed calls when you request.,Recover Deleted Contacts Click Contact To Restore ,click restore item selected show get item selected restore menu item click restore contact item,"This  application  can  restore  all  your  MANUALLY  deleted  Contacts, and synchronize  your  all  contacts"
"Interactions that you have with other users or content on the Service, and When you give us authorization, contact information of your friends from your mobile or tablet devices to connect your contacts and address book information with your Tinker account. If you choose to use the Service to invite one of your contacts to use the Service, we will send your friend an email or SMS inviting them to visit the Service.",Please grant Tinker permission to access contacts on your phone. GRANT PERMISSION No Contact ,get contact get input stream load ,"Easy  to  use;  syncs  with  contacts  and  you?€?re  ready  to  go, add  your  favorite  contacts  in  app  home  screen  to  make  the  call  within  a  couple  of  touches."
android.permission.READ_CONTACTS  (read phone contacts)    necessary to be able to make phone calls from the application,All Contact Sim Card Contact Save Exported Contact,set click listener click start get phone contact run background,this app need to read contacts from the device.
Reasons to request contact permissions is required to read and transfer contact data via Bluetooth.,Backup Contact Select Contacts,run bluetooth get contact,READ  /  WRITE  CONTACTS:  Required  to  display  and  read/write  contact  information.
the App may access your saved contacts only for purposes required for the proper functionality of the App such as matching incoming calls and filtering out already known callers from the App?€?s main screen.,No Contact Found,receive get contact name ,this app requires read contacts.
the App may access your saved contacts only for purposes required for the proper functionality of the App such as matching incoming calls and filtering out already known callers from the App?€?s main screen.,Create New Contact Save Contact Edit Cancel,selection parse build run get header field get value append get default start insert path size add create contact append send data,this app need write contact permission to create new contacts.
"We may also collect information about others if you use our Services to upload, share and/or distribute Content that contains information about them, including their name, image and online contact information.",Recover Deleted Contacts ,choose activity click add historical record persist historical data background background execute executor ,Contact  Recovery  can  restore  your  deleted  contacts  from  your  internal  phone  database  and  restore  them  in  the  original  Contact  thread
android.permission.READ_CONTACTS : To make a QR code for your contact.,ADDRESSBOOK Select from your contacts PHONE Create for phone number EMAIL Create for email address LOCATION Create QR for location URL Create QR for web URL TEXT Create QR for text contents APPLICATION QR for installed applications ,click start activity put extra set type add ,"QR  and  Barcode  Scanner  can  scan  and  read  all  QR  /  Barcode  types  including  text,  url,  ISBN,  product,  contact,  calendar,  email,  location,  Wi-Fi  and  many  other  formats."
Read Contacts - To load/show contacts for the purpose of setting ringtone for individual contacts. Write Contacts - To set ringtones for contacts.,assign ringtone to contact,click assign contact create cursor text get contact content,read  &  write  contacts-  to  assign  ringtone  for  a  specific  contact.
"Should High Quality Applications request and collect any of the following permissions or sensitive user data: microphone, camera, accounts, contacts, or phone",Top Ringtones Set as ringtone Set as contact ringtone Set as notification Set as alarm tone Share this super cool app Get more apps ,get stream get contact photo stream get stream content ,Assign  different  ?€?ringtones  and  notifications?€?  to  specific  contacts  from  your  phonebook
Contacts- the app may require access to your phone book to automatically fill in some required information for the QR code. ,Password create Create Owner details* Owner details Emergency contact* Emergency contact Health care proxy Health care proxy: Health information Health information ,share result get contact data address book get owner data address book.,"Share  the  name  and  contact  details  of  the  phone  owner,  and  the  emergency  contact  details"
"Read Contacts of User. In order to connect you with your friends already using VoMail , access to your contact list on this phone will be necessary.VoMail will not share this list with anyone.Your contacts will be periodically accessed for any new additions in the contact and sync your friends with VoMail services. ",Find from contact book,check permission get contact list get contact data,We  ask  permission  to  access  your  contact  list  so  that  you  will  know  who  among  your  friends  is  also  using  the  app.
You may also ask us to import your contacts by giving us access to your Device(s),Select contacts to share Call Log is shared.,load resource backup contact load resource update contact load resource open contact photo input stream.,"To  read/write  Call  Logs  and  Contacts  is  required  to  backup,  access,  and  restore  your  call  history  and  contacts."
"Read contacts: The App makes use of this permission in order to fetch contact data, including, but not limited to, the name or birthdate of the contacts. This information is used to show to the final user birthdate related information about their contacts. In any case this information is saved or sent by The App.",Add Contact Update Contact Edit Contact,get data get contact data,"This  application  uses  the  data  of  your  contacts  on  your  phone,  keep  all  your  data  if  you  change  your  device!"
Permission to access contact information is used when any of the apps need to look up a contact to identify the caller.,Speak name for contacts,get contact name receive ,Settings  for  enabling  or  disabling  telling  names  of  contacts  or  unknown  numbers  both  for  call  and  message
"See, edit, download, and permanently delete your contacts"" - in case you want to synchronize EssentialPIM Contacts with Google Contacts",List is empty. Create new,click update contact data import c v click notify data set handle message edit start delete contact data update activity open photo create contact data run process next message process edit send message ,It  allows  you  to  manage Contacts. Wide  selection  of  fields  and  unlimited  number  of  contact  groups  that  can  be  organized  hierarchically.
"Should My Ringtones and Sounds request and collect any of the following permissions or sensitive user data: microphone, camera, accounts, contacts, or phone",select contact choose Ringtones set cancel,activity result assign ringtone select contact,"Set  as  a  default  ringtone,  contact  tone,  SMS  notification  or  alarm  clock  sound"
Blue Ray does not save or upload your contacts. Permission to access contact information is used when you search contacts in Blue Ray search bar.,Select Contact Call Send SMS,click get contact list,"This  App  uses  permissions  of  usage  access,  read  contacts  for  secure  the  call  and  read  phone  state  for  call."
"For a better experience, while using our Service, I may require you to provide us with certain personally identifiable information, including but not limited to android.permission.READ_CONTACTS.",SMS template Edit Edit template E-mail template Share template Share type Sharing Share type ,click get contact send sms send email share,"You  can  send  SMS,  Email  with  preselected  contact  person/persons  or  share  as  text  with  other  applications  installed  on  device."
The Epic Data App will quietly and  automatically update your contact database on changes to your friends?€? contact  data.,"1 START: IN YOUR OLD PHONE Enter an Email Address and Password below, then click the ""OLD PHONE"" button OLD PHONE 2 FINIAH: IN YOUR NEW PHONE Re-enter your Email Address and Password above, then click the ""NEW PHONE"" button NEW PHONE Forgot Password * This app can transfer contact data",add update contact add contact group get group id run,"we  upload  your  contacts  to  your  own  password  protected  cloud  account The  Epic  Contact  App  allows  you  to  instantly  update  any  single  contact,  or  all  of  them  as  a  group,  with  any  changes  to  your  contact  data  you  choose  to  make"
Contact Permission is only required to display Contact Name in SMS and Call Log and to convert them into PDF.,"Generated PDF will include number of SMS being sent/received on daily basis. ""You can easily print Call Log SMS Chat of any contact from 'Specific Contact Log' Export to PDF Select any contact to generate PDF",execute executor background fetch background validation button verify get contact name number temp get call log data ,"E2PDF  allows  backup  of  sms,  contact, select  any  contact  and  get  PDF  backup  of  Call  Log  and  detailed  SMS  conversation/  SMS  chat  of  your  loved  ones."
"We may only use contact information of your address book, if you agree to provide it to us, for the limited purpose of sending them an invitation to use the Service or other products of our company",Select Contacts Import,set click listener execute parallel add record execute click get contact save b show show background click persist historical data ,Share  business  contacts and Import or Export  business  contacts
