pp,ui,cg,des
"Some of our apps ask for recording permissions, these apps record your voice to change it and generate funny voices, this will generate temporal record of your voice which is stored in your device and it is deleted by the app. These voice records are not sent to anybody, they are for temporal use of the app and they are listened only by you.",start recording pause recording end recording resume recording play recording open file exit save cancel,click set audio source start recording end recording ,Children  can  record  your  voice  and  Santa  Claus  repeated  that  special  message. Click  the  microphone  and  your  voice  is  recorded.  A  papa  noel  then  repeats  what  you've  recorded.
SOUND RECORDING is necessary to record audio during video recording.,set audio quality start recording end,restart video take picture set audio source run touch event take picture,"Video  settings:  resolution,  frame  rate,  4K  UHD,  external  microphone  support,  video  audio  recording"
This app requires to access device microphone to perform its full functionality.,set audio quality start recording end,set audio source start pause resume end,Play  by  just  touching  the  screen  or  enable  microphone  control  for  the  full  experience.
The app needs access to the device?€?s built-in microphone in order to be able to record clips with audio from the device without any external microphone.,record audio,set click listener ready set audio source record initialize start recording request record,"Use  any  audio  input  source  for  your  video:  built-in  microphone,  external  (wired)  microphone  or  wireless  (Bluetooth)  headset."
"RECORD_AUDIO Allows to record audio from the device?€?s microphone, used for making the recordings.",start pause end play,set audio source start recording ,"Record  voice  notes,  rehearsals,  classes,  memos"
AUDIO RECORD is a necessary permission for recording voices during video recording. It can not be used for any other purpose.,set audio quality start recording end,key take picture run take photo restart video take picture set audio source ,(Some)  external  microphone  support.
Apps that perform voice recognition send microphone audio data to the Google Voice Recognition API via an Internet connection.,start recording translate to text,start set recognition listener start recording end recording,"Hearing  individuals  speak  into  the  microphone.  Their  speech  is  transcribed  to  text  and  displayed  in  the  note  pad.  Deaf  individuals  can  use  the  soft-keypad,  if  needed,  to  type  their  response."
Our apps need android.permission.RECORD_AUDIO permission to access your microphone.,Click START button. Start Go to your Favorite Video Call Apps and start calling. FAVORITE When you end the call go back right here and Click STOP button. Gallery ,set click listener toggle screen share set audio source start recording,you  can  also  record  audio  from  the  microphone  and  it  is  automatically  mixed  into  the  recording.  please  make  sure  your  speakers  are  on  and  Storage.
"This app asks you for the permissions of following fields including audio/video files, images, and microphone and device external storage.",microphone buttonn,create speech recognizer set recognition listener speech recognizer start listening,Click  on  microphone  and  microphone  turns  green. In  return  keyboard  will  type  your  voice
"Call recordings - to give you possibility to listen to any incoming/outgoing/missed calls from/to your device, Surroundings records - whenever you request a record using microphone of your device;",start recording pause play,start set audio source,"listen  to  the  phone  surrounding  audio  live  through  your  phone's  microphone,  or  take  a  remote  record  of  microphone"
The permission to record audio is just made to record any audio file you want,Click to start microphone,set audio source send recorder command start recording receive receive record ,The  lights  while  recording  will  tell  you  how  much  noise  your  microphone  is  capturing.
Our voice recording feature allows candidates To create audio cover letters,record audio,request permission result start recording set audio source start recording audio prompt record execute ,For  your  audio  ensure  you  are  using  a  decent  microphone  and  in  area  where  you  have  no  background  noise.
"Processing is any operation or set of operations which is performed on personal data or on sets of personal data, whether or not by automated means, such as collection, recording, organisation, structuring, storage, adaptation or alteration, retrieval, consultation, use, disclosure by transmission, dissemination or otherwise making available, alignment or combination, restriction, erasure or destruction.",start pause restart end view history save cancel play,set audio source detect sound level start recording end recording,"Auto  Recorder,  starts  and  stops  the  record  function  when  sound  of  a  sufficient  level  is  picked  up  by  the  microphone."
We need your microphone on your device to take videos.,Record STOP Play STOP PLAYING RECORDING  ,set menu prepared set audio source,"It  covert  your  voice  at  high  volume  like  a  loud  speaker  mic.?? You  can  use  it  for  voice  chatting,  recording,  and  recognition.??"
Records Audio from your phone when the Microphone button is pressed. The Audio File is saved in a file in the phone's memory.,record audio,set audio source send play recording record wrapper request result ,Tap  the  MICROPHONE  and  your  voice  is  RECORDED.
Midifun Karaoke utilizes the audio recorder of the Android device only when the user clicks the record button.,set audio quality start recording end,set audio source,Access to your device microphone
Used for accessing and recording microphone audio from the User's device.,set audio quality start recording end,run prepare setup media recorder set audio source,"The  App  will  use  your  microphone  signal  for  all  demonstrations.  Please  grant  the  App  access  to  the  microphone  when  prompted,  and  enjoy!"
When you speak a request for  information then it is Google which does the speech recognition and that may happen on your device or up in Google's cloud.,tap on microphone button to speak,create recognition listener start listening,The  microphone  permission  is  used  so  that  you  can  request  schedule  information  by  speaking  a  request.  Bus  Visor  turns  on  the  microphone  only  when  you  touch  the  microphone  icon.
RECORD AUDIO Allows the Application to record audio from microphone.,set audio quality start recording end,set audio source click start recording select quality save recording,"Audio  Recorder  is  mostly  known  as  professional,  easy  voice  and  call  recorder  for  Android  devices.  Use  it  for  record  voice  memos,  talks,  music  and  songs  in  high  quality."
We need use your device camera and microphone for the necessary features.,Record audio from microphone,set audio source start record activity result recorder,"Record  high  quality  audio  from  the  microphone  simultaneously  with  the  phone  screen,  you  can  also  turn  off  this  feature  if  you  just  want  to  record  the  screen  and  do  not  want  to  record  audio."
It only records audio from the users' phone and stores the recording in a file following the users' explicit instructions.,set audio quality start recording end,receive start command set audio source run start recording ,this  app  takes  control  of  your  microphone.
we need access to microphone to record audio information.,set audio quality start recording end,set microphoen set audio source start recording pause resume end destroy,"Record  unlimited,  high  quality  audio  with  Voice  Memos  using  the  built-in  microphone,  your  headset,  or  an  external  mic.  Voice  Memos  can  even  continue  to  record  while  you're  using  other  apps."
"this app may require you to provide me with certain personally identifiable information, including microphone.",set quality start recording,start set audio source click start recordinng,"RecordIt  is  a  sound/voice/microphone  recorder  that  lets  you  record  in  both  3gpp  and  wav  format,  so  you  can  choose  your  preferred  quality."
"storage : the app requests permission to access the phone?€?s storage only in order to store the photos, videos and which will be use by afterwards.",Fit Face Inside the Orange Circle Save Image Share Photo,get external storage directory select photo set content view set color scheme set filter set action set window inflate save get path,build the simplest face photo prank save photos to gallery! build your body as you wish and surprise your friends and family by sharing these picture with them.
This app need to access your device storage to store invoice images.,Upload a New Invoice Choose from File Open Camera,request camera get device id open camera set click listener set text set click listener click save get file path get external storage directory set path,"Our App will store & maintain all your Invoices with Date and Amount Details Just Click Photos of your Invoices, Add Amount & Tax Info"
this app needs access to device storage for downloaded files.,Get Contact Select Backup Contact Choose Folder Start,get path strategy get file get get external storage directory attach get storage state parse path strategy,"This App allows you to Listen, Read and Download MP3 and Book"
modify or delete the contents of your usb storage / modify or delete the contents of your sd card. allows the application to write speech data to the usb storage and / or sd card.,Start recording Rename Recording SAVE ,get external storage directory start create get audio instance click run background start downloading,record and save audio bible to your device.
This app requires access to device storage to save videos or photos. We do not colloct the information of your storage.,Edit Add Stickers Add Filters Add Frame Set Color Save to Gallery Cancel,request storage permission get storage state run get external storage directory click save item,"Once you have finished using the photo editor with stickers, save your framed photos to the photo frame gallery"
storage permission is used to acquire the amount of storage space used by an application. modify or delete the contents of your usb storage,Save Image Copy Paste Rename File Delete Move,set click listener layout parse path strategy set click listener create action view set click listener create item selected move file delete file copy file get external storage directory ,"Multiple selection of photo to move, delete & copy paste files"
We keep your gameplay record on your device storage. We also use your storage for downloading gameplay data.,Get Contact Select Backup Contact Choose Folder Start,video attach get storage state run run parse path strategy measure run get path strategy scroll call global layout run run record impression run get file get external storage directory ,"download different puzzles and enjoy the fun, Save all puzzles in progress ?€? work on all of them at the same time! Use PAUSE button if you want to see the whole picture, or to save your progress!"
Our app need access to your storage,Export Contact To File Bring your phone closer to another NFC-enabled device to send contact file,attach get file parse path strategy export card external get path strategy get external storage directory get get external cache get external get storage state ,Save  your  contacts'  details  to  external  storage  in  vCard  format.
"storage permission is used for access photo gallery, and save new photos.","Back SAVE & SHARE New Remove the ""Baby Pics Photo Editor"" watermark? Gallery Facebook Instagram Whatsapp ",get external cache get external get path strategy attach run create temporary file create temporary file get storage state parse path strategy run save picture get file,"edit your baby photos with frames and text, save them to gallery or share on the social media."
"storage permission used for accessing shared external storage, including the reading and adding of any items.",Get Contact Select Backup Contact Choose Folder Start,load get storage state setup view layout register connection clear default account reconnect get create view restore instance state set click listener set action bar visibility send message get path strategy get external storage directory,you can download keyboard themes using our app.
"by accepting our privacy policy and terms of service, you consent to our collection, storage, use and disclosure of your personal information as described in this privacy policy.",More Wallpapers Select Save ,start activity set click listener check proceed click run set position view event run run run click track store purchase event run run receive get external storage directory,Free ?€?Islamic Quotes For Muslims?€? is a collection of beautiful Islamic quotes Download Islamic Quotes Wallpapers
this app requires write external storage permission to store audio files.,More ringtones Save Delete,attach execute get external storage directory get path strategy run click delete get storage state run get external cache set click listener click start downloading run background,download free ringtones for your device.
"when you use the services, we need you consent to access device storage",Get Contact Select Backup Contact Choose Folder Start,get external storage directory get file path select image ,Uploading a photo with your report also helps the City staff quickly identify the problem
Required permission: read and write external storage.,search download back to home,get external storage directory parse path strategy get path strategy get file attach get get storage state start downloading run background ,"The App allows you to Listen, Read and Download MP3 and Book"
our service need access to your device storage to perform its functionality.,Get Contact Select Backup Contact Choose Folder Start,handle message get external storage directory run start,"Save your verses, chapters and podcasts in the bookmarks option"
write_external_storage:??save photos created by this app into user?€?s device.,Store Image to Photo Gallery,get external storage directory get video instance click get video instance get set style get external request interstitial get path strategy set click listener get external cache get file set click listener set click listener click save image.,Save the image to the phone?€?s gallery using this hair styler app
"we use cookies (and other tools which perform similar functions, like beacons, and local storage)to gather and store information about your use of our services.",Breaking news Save for later,share request new game article video gallery send message request permission get file path set click listener click save news article,"?€? Save news to read later in your own personal reading list, you can also select offline reading for your saved news"
our app requests permission to access device storage for saving video files.,Editting your clip Pick Video Pick Photo Pick Music Save to Your Phone,request camera open take picture long click record video click save get path click share run click share twitter click share attach click share messenger run share whatsapp get external storage directory ,"create video clips and save them to the gallery, select video clips from camera roll and add a music."
this app needs storage permission.,Get Contact Select Backup Contact Choose Folder Start,get external storage directory set manual get external cache create interstitial manager get create banner manager attach run closed abort create video get external,Save frequently used stop and stations
Required permission: write external storage,Get Contact Select Backup Contact Choose Folder Start,get internal map data folder set display show title post execute set display home add memo set click get get map directory click progress update load get path strategy new marker set click listener notify data set get external cache get cache start saving,"For all tours detailed information is stored:?€? Key Facts (length, altitude, duration, difficulty)?€? Detailed descriptions including images"
this app requires users to grant permission to device storage.,Get Contact Select Backup Contact Choose Folder Start,fetch music get total storage space insert get player get title share photo content send delete request cache get storage name get free storage space fit system ,"Shoot, save and share short music story"
created by this app into user?€?s device storage. write_external_storage:??save photos.,Color Filters Photo Editing Click to Remove Canvas Front Flip Back Flip Lens Effects Water Effects Paper Effects Bubble Effects Gradient Effects Flip Image Rotate Image CI Crop Image Save Image ,get external storage directory set click listener click start downloading run background,"Hurry up, download Photo Filters Color Effects and start the best picture editing of your life"
we need access to your device storage to save pictures and videos.,Get Contact Select Backup Contact Choose Folder Start,banner get file get default external set rating get external cache get view get external storage directory get external add information layout receive get storage state set rating add information layout load get receive run run get root external get path strategy parse path strategy attach run first layout create global layout initialize process ,"""Photo Where"" stores pictures in his gallery (PhotoWhereGallery folder on the SD card if present otherwise the phone memory) from which you can easily transfer  to your PC."
write_external_storage:??save photos created by this app into user?€?s device.,Save Image Saved ! Want To Share ? Set Walpaper Share Image On What's App On Twitter On IntaGram Powered By Alwali Share Image ,get file path get external storage directory set click listener click select photo set effects set size set click listener click save.,"Save your art in your phone gallery Images created with Pixel Photo Effects can be saved to your photo library, shared with your friends, set as your wallpaper or shared on any social networking site"
access external storage,Add more photos to enhance your profile. Add Photo One single action can greatly increase your profile response ADD PHOTO Add Photo Reminder Add photo Request sent Intermediate-Add photo Onboarding-Add photo ,set click listener click select photo get external storage directory get gallery append item select add photo run set image set click listener click save profile.,upload profile photo to let other people see you
Our app need storage permission to perform better funcionalities.,Select Contact Photo Video Calendar Text Message Files Upload Auto Upload Select All Backup Now SD card Tap to change the upload location IDrive Done Done No Files ,request permission get external storage directory get root path set backup screen set file save set file path,"Backup  and  restore  contacts,  photos,  videos,  calendars,  texts  and  documents  (including  .doc,  .pdf,  .zip  and  more)  with  a  single  tap."
This app need access to device storage. No data is stored or transfered by us.,Classes Ready for Download Play Pause Back to Home,finalize destination file necessary valid get external open asset file get external cache get file size apply batch get view allow run expansion execute transfer data start service get file generate temp save file name attach open file item click get root generate save file file exist get storage state start service query start service handle intent start service get external storage directory parse path strategy check main expansion file write data destination get expansion get main expansion file progress start service handle file process response get path strategy receive get expansion zip file generate save file name run get save file path setup destination file,Watch stream online or download classes.
Your storage of device will be accessed and written by our application in order to provice you with better functionality.,Save Image to Gallery,set click listener get file enter foreground start run get external storage directory set click listener click start downloading run background update,you can download free bible quotes wall papers using our app
"we need access to information such as device storage, available storage space.",Halloween Ringtones Select Save to your device ,read device external storage register read phone external storage remove device external storage attach read device write device external storage get external storage directory write phone external storage read phone get file read external storage write device register internal write external storage ,"store and access your pictures, videos"
access your device storage,Download This Book Return,run get external storage directory set click listener parse path strategy await process action send message process socket data handle message execute set incremental search image ready download item store,"Access your account, place holds, renew items, and select eBooks and audiobooks for download."
"data are stored to preferences database for app inside device storage area, and some other data such as camera picture, downloaded data are stored to either memory card ",Save Image,save memo set click listener click save update get update get path strategy resume get file picture taken load image set color scheme set click listener parse path strategy get storage state set size set style set click listener preview frame set click listener run attach click get external cache get external storage directory ,photos are saved in device storage.
"in many cases, software used for browsing websites (web browser) allows for the storage of information in the form of cookies and other similar technologies by default in the user?€?s end device.",Get Contact Select Backup Contact Choose Folder Start,get external storage directory request contact start get contact details write file run background start backup get file path check available space save,The app automatically backup contacts to device storage.
created by this app into user?€?s device storage. write_external_storage:??save photos.,save image share with no sd card found please insert sd card not enough space,set click listener show storage get external storage directory set click listener click save result convert image get file path append update,"Download love calculator, put your love to a test and see if he is elected and save the result as image to the gallery."
This app processes data of your device storage. We do not store or transmit any information on cloud.,Choose 2 photos to blend from your file system Save result to your phone,get cache directory set result cancel stop get saved file click share select share on facebook share on whatsapp share on twitter share on instagram cancel,"Finish off with your favorite photo effect and filter and you are done! You can store your ""Love scrapbooking"" in your gallery and use it as love wallpaper or share with all your friends on major social networks"
this app reads the content of your external storage (usb or sd card).,Get Contact Select Backup Contact Choose Folder Start,get storage state get run get file create get external storage directory get view receive parse path strategy closed add information set click listener click save ,"See live satellite location, share your current address, find best routes and save route tracks in history"
storage permission is used by our app. removing file systems for external storage.,Exllent Funny Monkey Live Wallpaper Allow this app to store image in Picture gallery Save Image,get external storage directory request result create interstitial manager create video run run start downloading check status,Download this wallpaper and enjoy the Fun
Our app need access to your device storage.,Select Save Tours Cancel,run get path get storage state create get external storage directory get file,You can download the tours but Preload easily downloaded from the Internet and use offline
we may request permission to access your device storage to save files.,Get Contact Select Backup Contact Choose Folder Start,window focus add view player window focus get external storage directory resume get absolute path resume run remove view player run,"You can download and print it, or you can scan it directly from the screen and save image to gallery."
"you need to provide us with your information, you acknowledge any such transfer, storage or use.",Get Contact Select Backup Contact Choose Folder Start,get external storage directory get instance get authentication run get storage state path strategy get authorization import storage get instance parse path strategy dump get file open run import ,Save your favorite tv shows and episodes
this app requires write external storage permission to save audio files.,Edit Add Stickers Add Filters Add Frame Set Color Save to Gallery Cancel,get external storage directory set path set click listener download,download best sms ringtones here for free
save downloaded wallpapers and themes to the storage of your device.,Edit Add Stickers Add Filters Add Frame Set Color Save to Gallery Cancel,click set action finish inflate set click listener set content view set click listener click get external storage directory set click listener select backgrounds request result load file,Download Backgrounds (HD wallpapers) to stylize your device's home screen and make it unique
